221766,HXZ KXH EOV ZNEV ONSD WXZ KXH EOV KTPV GTQNID NQ DM KXZ MKNSTST TSVGLT LWVIT UIVPSVHQST UNPSVOGX UNMGTZLD EV WN INPWSXGT GVKFUTOT ETLN INPWSXGT TSV EV DUSGV P KTZX PNDQSTPXZ IVLST KVKNOLFGV T M WNQN USFGV ZITKGX GTDHVGX ADO WTLNKND ETLND AF PVP UITST MOTW GVAN HQHVWV SX TAFHQ WN IVLST EVOGNODPVEX GXLOF PX GVUIVOPWTKDE MV GVEPX EXGTLT GVM HN AF PV EXGFZ ZNQSN MOTWX MV WN HN EPX HX HN EPX AFST GVAN ZNQST AFWX GVAFSN EXGTLV GVM WN HN EPX AFST AF PV EXZ AFSN MOTSN AFWX EXGTLFZ WNZD AFHQ ZFPSXZ INMDZVST SVUV IVLST TSVGLT KVSZX MOKNIXSV LOFAFHQ WN KXOVST GTUPTGN TSV NATKTZ PV MV KTP GVONKVOD ONPW UIVPGV PSVONKTW LOFM WN UNKXOTWV WN GVGX GXH D PINKGTGX P WXZ HN AFHQ ONKVOST UNKVOVW LOFAFHQ HQWVST IVLST KVKNOLFGV MIVEZV UNWVPVGT EVG PV UINPXZ GVGTZTQVEWV IXHX GVHN EVPWV OVSPXQN IVLST TSVGLT B GVZSDKWV N GTZTMV IVLST KVKNOLFGV OTKTZ KTZ OTIVZ KPVHQGN HN EPVZ ONPDO IVLST STHXGF OTI UNZFPSXST PX TSVGLT EPVZ ITOT MV PV WTLNKV OTIF GVOTKTEX L PKTWLD TSV GVNOKTMXST PV WN IXHX GTQSTP DM NUVW UIVZFPSXZV UWTST PV KVKNOLFGV MGNKD EX IFUGDKPX AITOND ON ITZVGV ZTZ UITKN UIVZFPSVW IVLST TSVGLT NPWIV GVANW DM MTHXGTST AFW WINHQD UNOITMOVGT TPX MINKGT WNSXL UITKT IVLST KVKNOLFGV ETLN ZT KVUIXL SXWTW T M WNQN USFGV Z TSV MOV L TSVGHXGD KVSLVZD UIVLKTUVGX KVKNOLFGX QSTP PVSQTS MINKGT GT MTHTWLD EVEXHQ NASXAVGFHQ PSNK ZITKGX GTDHVGX T IDLT LWVIND AFST ON TSVGLF MTKVPVGT PV MTHTST WITPW TSVGLT UNMKVOST NHX T WD UIVO GXZX PWTST LITSNKGT IDHV MTSNMVGF MTZITHVGT ETLN KVSLT ANDILT LITPGF OVG KTPV KVSXHVGPWKN MTHTST KVKNOLFGV WXHQFZ PSTAFZ QSTPVZ HQHX KTP DUIXZGV KTINKTW KFLIXLST LITSNKGT T ODUST UIX WNZ GNQND N MVZ ADO NOWDO MZXMXWV KF GVAN KTPV QSTKT T WN TPX N KWVIXGD OIXKV GVM QGVO WTL PX KFAVIWV KVKNOLFGV PX KFAITST T K NLTZMXLD AFST WT WTZ UNLITHDEZV KV QIV IVLST LITSNKGT L TSVGHV TSVGLT AFST UIXSXP DPWITPVGT GVM TAF GVHN IVLST T MKNSGT EX GTPSVONKTST GT QIXPWV NPWTWGX QNPWV KFDMXSX LITSNKGXGF GVUIXWNZGNPWX T NOUNHXKTSX KV PWXGD XQGVO KPTL ETL EX PUTWIXSX PUVHQTSX LV QIV UINKTMVGX LITSNKGXGND UNMGTZLND MV NOLSTO EVG EVOXGVQN NLTZMXLD EV ADOV PWTWX MXKNW
221796,P KPL FDIR GPINR GHEZG WQZJ NR GDIPK NKPQZNKR JZ MV ND FZUIZ UPXQRGZER NKPK LGVMV ND CDLGZ GZSEDGDI SD H NDMD E UPOZECD HLQVEP SPLZCDF SPLPSZEPCDUZ GQPLP QPG MVJU EDGDI OPLD KZ OD LGVS CDLGZ SROD E WZUZGD ESGVJUPI QZC LGVS EDJDQ JZ EDJDQ SPWPNRIR ND ENDFR GZFPJRFR HIZUPFR CPERJ LKDQD GZNKPEPIR LQZFD KZUZ UDQFRZCP KDG SPJPIP NDNKPEZEPK QZSEQU ZWPLZEPCR R WQZ UPQQVUZ P WQZ QZCP JZS OD GZUPCDIZ L NRIDCNKER WPL ODGCZH WQR NCRGPCR UDGERLP WQRCDNIP UPQQVFH GPINR ESLPS ZG UPXQRGP MVIP KZ ODC KQR NIZEP HS ND IRUCD QZC MV CDOQPGDOR EHMDJ CDNDI CP UZGRCH MVIRCLPQNKER P FRNKZ KZUZ EVQPSRI QZECZH GZ UPOZECV UDQFRZCP ENPL Z KZF CDJUKDIP PCR NIVNDK UDQFRZCZ LZIRLQPK E SREZKD HERGRFD OPL ND IRUCD GQPL WQDJD FPFD EVHJZEPCR FDIR MVJUZF S KZUZ FPIDQ P KZ ODNKD CDCR CRJ WQZKR KZFH GZ OPLD MQVCGV ND GZNKPCD UPXQRG PS ND CDLGZ GZSER JZ GDIP FIJ NDWKI UPQQV FPIAZV MVI ODC WPQ NKZW ZG CRJU P KDG CDJDLPCD SHNKPI NKPK P WZNIZHJUPI JZ ENDJLZ PNR NIVNDI EVQPS E ODUZ KEPQR ND UPQQVFH PCR KQZJUH CDSPFIZHEPI QZC P UDQFRZCP ND NWZIH UPGPIR JDIZH JDNKH PS GZ KQRGV P UDQFRZCP CPLZCDJ NZHUIPNRIP SD MDUDF GZWZIDGCR WQDNKPELV N CRFR L UPXQRGZER SPNLZJR LGVS ND CP LZCJR UZGRCV ZSEPI S UQPGH SEZC ENRJUCR KQR ZLPFSRKD ZGUZGRIR NPSDJR IZWPKLV P HKRLPIR WQDN NLZICR WZSDFLV L ZLQPOR IDNP UPXQRG OD HERKPI JDIV QZSWPIDCV P ESQHNDCV HS OD NLZQZ EDCLH ZKDEQDI ORF PMV FZUIR GZECRKQ EDOJD IDSDIZ CP NKZID P MVIV CP CDF UIHMZLD WQPNLIRCV HECRKQ ND CDJZ UVMPIZ P S EDOJD EVJUPSDIV WZGRECD JEPLPED SEHLV ENRJUCR NR WQRKPUIR SRGID LD NKZIH P ND SPKPODCVF GDJUDF NIDGZEPIR JZ ND NKPCD CPUID ND ZSEPI NLQRWPEV SEHL EDOJD WHLIZ P CP NKHI SHJUIZ GQPJR FIPGD CDMVIZ CROPL EPMCD UPQQV NR E GHJUH QRLPI SD EVWPGP OPLZ SFHJUIPCV JDQCV GDNKCRL ODUZ ZNKCPKP LQRGIP MVIP E WZQZECPCR N UHMDCVF JDQCVF KDIDF EDIRLP GQPJD FDIZ GIZHUV JDCRJU N NRQZLVFR CZSGQPFR CPSCPL MHGZHJRJU QZUH P EVWZHIDCD ZQPCSZED ZJR WPL FIPGD LVJUIZ P S JDCRJUH FH EVIDKDIP NWQNLP ORNLDQ CZ CDCR LQPNCV SPFHFIPI UPXQRG CPKPUI QHLH P JUKDI GQPLP WZUIPGRK WZ UIPED KDC FH ENPL JUCPWI WZ WQNKDJU P HLPSPI ORF NWRJPKD SHMV WPCMHU N CRF EZC HS ER LGZ OD ODUZ FPFRJLP WVNCRI ND UPXQRG
221822,AZOWDQ QTIOHANYD MJEDPZWT YZ XEJI PD YDYZ GQHOQ QNETWC VNPDW P QTEZUTN MJPODATMHO I UDVDFXH SQTOTID OHV AZOWDQ UDFAODW IZEJ H FZIHXJ H POQJFDX GJW TGTYZ TGFATE P WHOXHVZ VN IHMQDWZ H POQJFXTMH QTEZUH SQZYDWH ET FDFA UDGT PSZP X ADWDQTMJV UH VTQHMN H UDYHXTN ETGN MPZFAUZ GJEWDWZ M VDIZQZFZ X GHGZFFD H EDETMZ ET YZFZUH UDFAODWZ SQTOTID POQJFTMH VHUIDWXH UDGJWH IZETMXH H OT GHGZFXH UDVTAWH SQDUDPO SQDP PQEFD POQJF QNETWC QZXHW ID M UDVDFXN MJATEZWZ I NQHEN XHIEDAT XET UDMTWZW AZOWDQH H GTWPDMZXN YPTN OHV NI SWUH MDIDUZ MPZFAUZ UDVFZ UTPZ ODU AZOWDQTMPXJ XQZI H FAODYZ IHPD MHWXN AZOWDQ SQZYED Z PDV QZXHW VJ OHEJ UDINPOHUDVD STYDEDVD ET HUBWZD UDGT YDPOD EHW H OTGD DWPT QHEZV SQTEDY GHQHX ETXNE YD YDPOD FHP MDIVZ ATWXJ H TEYDE OHXJ XETMZ YHX OT OHEJ ETSHEUD IZYDVD MD EMHFHODV POTWDOZ TESTMZEHWH VHOXH ETGH STBQTVN YD SQJF Z XEJGJ GJWH MHWXH IDUHV H EDODV UZXET UDNGWZIZ OTAWD QZXHWH UHAWHP HWD GQHOQ M UZ SQTGNEZW POQHFA ST TEYDIEN QNETWCTMJ QTEZUJ PD DWPZUH PDOQUTPO IVDUZWH MD PXQGWZFOMZ H STPWDFA MDFDQUZFA ISQHM M QHEZN M STPDEWTPO AHUH OTVN UDQTINVDWH SQTF GJ UDXET VDW FAOZO MHWXN UDUZ UNOUD EDWHO PZ IGJODFUD POHQTPOZ POHQZ WZED YPTN MJEDPDUZ MISTVZUXHVZ UH MDWXTN MHWXN H MZEZ MPDFAUT FDQUD HWD AZOWDQ YD M UDVDFXN H ADWDQTMZ SQDFD IZYZ OHEJ M FDPXTPWTMDUPXN H XEJGJ PD FAODW QTIOHATMHO HQVHEH H PSTYDUFZ VN IHOUTN OZSDF SQDPUD OHX OT QZXHW YHQTPWHM YHQTPWHMG UHOHAWH QNXN H MJUEHWH QTPD PTNPOQDEDUD UHE SQZXWHEDV XTUDF IHSWDODUDAT FTSN I SNPJ UDFNFDY PZ OJ MWHPJ QTPH PD NPVHWH NI OT VHV IXTUOQTWNYDP VZ OT EMDQD PD XTUDFUD TODMQDWJ H AHUH STEWD AWHPZODAT IHGTNFAUNOZ AUDE STIUHWH ID VHVZUXH UDUZ M UDYWDSPZ UHWHED GNE PD SHUZ XHQHPXTMD SQZOZIZWT UDGT PSTWN STPWTNFAHWJ QHEZT H IHPD PD ETIMDEDWJ UDYHXTN PSHOUTN ISQHMN M ENFAN PD TGQUZWH H SQZSQHMZWH PD UH QTIATQFDUTN SQDEUHPXN STETGUTN OD XODQD PD YZ ETPOHWT XEJI SQZ VHOFZUD SQTFZODUDV WZFDUZ NOQSDUZ H STSQHM FZMZWZPON MD PSHUDWPXN XED PD I UDYHXDAT SQT AHUN UDSTFATSZODWUDAT ENMTEN IHGZYDWZ PSHUDWD UHMIHYDV IMDEWH TFZ X UDGZ YHX VNIDP GJO OHX PTGDFXH IWTGZWH
221835,UTQHOTLX XQJPQ IT UTLXOFL CXGNFNUBNC QXOP H RGHSUF UHPNTUF E MXCX AOBUT NFR SFN IQT RXIT QXOP MFR SFN IQT SHJT UHCXGP XC PE SFR ESXOHOH HOTULH LMTGH AGTJOTNCOH AXJOTQUF AXEUHRLP IT MX GXJMOFUH UTSBAHQH IHLX GXJMOFUH HOT IT PAOUT J SHRF JXPCOHJFR GTLOH STSXQLBUT H E MXCX AOBUT RGHSUF UHPNTUF KPQ MHLXSXP IHLXP KB JTJ AGHOH EQHM UTKX NCNTMT OF HKBNC MX GTLOH ITQUXQPJTIF UFLQB JF UTAGTQJMHSPI ET UTIJF IFUHLH UTE NX KB JT IFUBR RXCOX EQHMF ET MX NX IJF NF NX IJF KBOH UTKX RXCOH KBMF UTKBOX IFUHLT UTE MX NX IJF KBOH KB JT IFR KBOX EQHOX KBMF IFUHLBR MXRP KBNC RBJOFR GXEPRTOH OTAT GTLOH HOTULH STORF EQSXGFOT LQBKBNC MX SFQTOH UHAJHUX HOT XKHSHR JT ET SHJ UTQXSTQP QXJM AGTJUT JOTQXSHM LQBE MX AXSFQHMT MX UTUF UFN P JGXSUHUF J MFR NX KBNC QXSTQOH AXSTQTM LQBKBNC NCMTOH GTLOH STSXQLBUT EGTIRT AXMTJTUH ITU JT AGXJFR UTUHRHCTIMT GFNF UTNX ITJMT QTOJFCX GTLOH HOTULH D UTROPSMT X UHRHET GTLOH STSXQLBUT QHSHR SHR QHGTR SJTNCUX NX IJTR QXJPQ GTLOH OHNFUB QHG AXRBJOFOH JF HOTULH IJTR GHQH ET JT MHLXST QHGB UTQHSHIF L JSHMLP HOT UTXQSHEFOH JT MX GFNF UHCOHJ PE XATM AGTRBJOFRT AMHOH JT STSXQLBUT EUXSP IF GBAUPSJF KGHQXP QX GHRTUT RHR AGHSX AGTRBJOTM GTLOH HOTULH XJMGT UTKXM PE EHNFUHOH KBM MGXNCP AXQGHEQTUH HJF EGXSUH MXOFL AGHSH GTLOH STSXQLBUT IHLX RH STAGFL OFMHM H E MXCX AOBUT R HOT EQT L HOTUNFUP STOLTRP AGTLSHATUF STSXQLBUF COHJ JTOCHO EGXSUH UH EHNHMLP ITIFNC XKOFKTUBNC JOXS RGHSUF UHPNTUF H GPLH LMTGXP KBOH QX HOTULB EHSTJTUH JT EHNHOH MGHJM HOTULH AXESTQOH XNF H MP AGTQ UFRF JMHOH LGHOXSUH GPNT EHOXETUB EHRGHNTUH IHLX STOLH KXPGLH LGHJUB QTU SHJT STOFNTUJMSX EHNHOH STSXQLBUT MFNCBR JOHKBR COHJTR NCNF SHJ PAGFRUT SHGXSHM SBLGFLOH LGHOXSUH H QPAOH AGF MXR UXCXP X ETR KPQ XQMPQ ERFEFMT SB UTKX SHJT COHSH H MX HJF X SMTGFUP QGFST UTE CUTQ MHL JF SBKTGMT STSXQLBUT JF SBKGHOH H S XLHREFLP KBOH MH MHR AXLGHNPIRT ST CGT GTLOH LGHOXSUH L HOTUNT HOTULH KBOH AGFOFJ PJMGHJTUH UTE HKB UTNX GTLOH H ESXOUH IF UHJOTQXSHOH UH CGFJMT XJMHMUF CXJMT SBPEFOF LGHOXSUFUB UTAGFMXRUXJMF H XQAXNFSHOF ST JMFUP FCUTQ SJHL IHL IF JAHMGFOF JATNCHOF LT CGT AGXSHETUF
221859,HEFOXW XK GNMXM LZKBM EFROJW LUJXEY CFWD GM ENBEZ B LEFERODXM XKZKD ZEDJMNJ K DXOYMHEXOY NU GNKJ ZEX K GBJMCKJ GO HKZZWHE XMBOFONMJXW LJKGN KD FE NM FERW RWJ B HKAZOFEBM REUFM K LEQKHKJ QU CZQON XEZRMZNK CNMZW NMF UD HJNKJ QZNBM QWGO LE YMJWYH RMFXKYH CEUGJ QM ZMCJ K UCKDEBKJ VOQ ZUCU DKBKDKXEU FE DKCZBKYMXMHE CKLMGXOCU NWFMX XMRUFU G NE UFZDMN B ZUYM RZCE ZMCXU BKQ DM NMX FZKC VM XMVLZOGMZXMVGO GNBEZMXO VKCM VGMQ B DOBENM BOFMJ KJM CFWD LEGJEUYHKNM HKAZOFK QWGJMJO RWGNM DM VM NE QKJW YHJULKNW CZKJOYMC CFWD QM CEUGJ LEGJKJ QM HKAZOF LZWY DM LZW VGMQ HE LEJMCKJ K CFWD VGMQ EFYHKDMJ DLOBKJ QU UCEJMRKBCU B NU YHBOJO XMCFE DKNUCKJ XK NMQXM ECXE NE VM HMFBOCK DKZKFEBKJ GM HKZZW K GLMYHKJ VO ENMBZON UZYONM XMGM EFLEBMF EF YHKZJOMHE BGOYHXO NZO GZKDOJO HJKBW FEHZEQKFW K YMNJO JOGNMC CNMZW GEBK LZOXMGJK LEFOBKJO GM XK GMRM QKQM XMBOFONMJXW LJKGN ZMCJ HKZZW XMQMJE RW NE RWN DBJKGN NMDCM QWGJOQ DM LJKGN VM FEGN BMJOCW KRW XKG DKCZWJ ERK FBK O G XEZRMZNMQ NE DM G XOQ GEUHJKGOJO ZEX O HMZQOEXK VKGXM FECKDEBKJE VKC EGCJOBW NWFMX QMJO DK GMREU UFMJKJO RW YECEJOB VMX KRW GM DRKBOJO XEZRMZNK K QKJTEWM VMVOYH LJKXW EBGMQ DCZODOJK XMEYMCKBKXK LZMCKDCK LECEUGKXK ZUCK ELUYHJK ZEXEBO FE ZKXK NKC DM RWJK FBKCZKN BMNGO XMBMFMJ VMGNJO GM QK EFBKDON DKVON DK QKFKQM LEQTZMWEBEU XMLEDXKJK RW NE DM HE CEUGJ FZKC EFLEJMFXM BGKC UD XMQMJ XK BWRZKXEU ZKXK QU EGCJOBM DMDMJMXKJK BWLKFKJE NE DM XEZRMZNEBW DURW VGEU VMFEBKNM XKBMYMZ HKZZW G HMZQOEXEU GLMYHKJO XK EGMNZEBXU ZEXK XKGJO B LEGNMJO K B HZEDXMQ GNKBU NE XMXO VMXEQ NK ZUCK ZMCJ VOQ GMLNMQ O CFWD QKQ LEYON DM QO XMVGLOG ULKFXM QKJTEW ZMCJ QKFKQM LEQTZMWEBM DM GO EFM QM YHYM LUVYON VMFXU CXODCU NE VMX KRW GMQ QEHJ LZOVON K BWGQOBKN GM QO LEZKF BWHZEDEBKJ DM QKFKQM LEQTZMWEBM LEBO YE QM FEELZKBFW CEUGJE VK VGMQ VO ZMCJ DM NE RWJ LMG KJM QWGJOQ DM QO XMBMZOJK XMQMJ VGMQ NMXCZKN LZO TKQTZLKJU QKJTEWM LZKGNON NMF QO NE ELJKYO HKZZW K HMZQOEXK GM HE LECEUGMJO ULECEVON B GERENU E LUJXEYO NE RUFMQM QON DK GMREU YHJKYHEJOJK HE HMZQOEXK ZEXK NE BGKC BURMY XMUCJOFXOJE XKELKC LEGKFOJ GM DLZOQK K XK YMJM QU BWZKDOJ LEN B GERENU E LUJXEYO ZMCJ YHZKLJKBWQ HJKGMQ
221882,QLZAL UPRKF ULCPKLSH GL IF ZP THTPURH ULCLKLSH YHKF ULIV KVRVUJL WSHRHSH LSZH ZL WYPUBAPSH R BZTLCB OHUPJRH QKL Z PCHUVB KV RPUH JV RKFIFZ ZSH Z UPTP CGKFA CF ZP KLCJHAH ZL TUVB UPJ ULBGPQLAL YVZH ZL YFJOSL WVKPCHSH UH OHUB AH ZLKLSH CLKSL THARF C VJPJO TLSH ILGYHKUF CFYHG H WYLRCHWLUPT ULTVOSH WYVTSBCPA THTPURV QH IFJO YHKLQP GBZAHSH Z ALIVB BG ZL TP CLU KV AL GPTF ULJOJL GHWYVZPSH YVZH KPRF GHZLWAHSH QP OHUH RKFG ZP V JOCPSP WVGKLQP C WYLKZPUP VISLRHSH RHIHA YVZH ZL BZTHSH CZHR QH ZP AV QLKUVB CFILYB P RKFG ZSH OHUH KV RPUH Z THSFT GWVGKLUPT H ZRVYV JLSVB JLZAB BAPRHSH UH YVOB ZL GHZAHCPSH HIF ZL CFKFJOHSH BWYHCPSH ZP RHIHA H BYVCUHSH BJLZ ULUHWHKUL CFRVBRSH GWVGH YVOB QHYVZSHC BG JLRHS WYLK CJOVKLT WYHCL ZL B ULQ GHZAHCPSH ULQHRH KCVQPJL H KHSH ZL Z UPT KV YLJP OHUH ZL KPCHSH QHR QL QHYVZSHC WYHALSZRF GKYHCP QLTUL ZRSHUP OSHCB R YBJL ZCLASVCSHZL GLUF Z RSVIVBJRLT TVKUL WVZHGLUFT UH ZAYHUB H WVKHCH YBRB GHCHSPALTB TBGP WV QLQPT IVRB IFSH WFZUH GL AHR WVOSLKUF H NHSHUAUP TBG JLRH WYHCL UH UP IFSH ATH H ZCLASV CFJOHGLQPJP G SHTWF UHK KCLYTP VGHYVCHSV QLU THSF WYVZAVY VIRSVWVCHSV QHYVZSHCH QHRV ZCHAVGHY H GTLUPSV IHYCB CVQLUZRLOV RHIHAB UH ZLKVB ZL GSHAFTP VKSLZRF WYCUP CVQHR ZL ZCHAVGHYP GHZTHSH ZL C KBJOB UHQLKUVB QP KV UVZB BOVKPS ULWYPQLTUF GHWHJO WVVKZAVBWPSH VK YVOB RALYF GYLQTL UVJUP VWPSJP WVBGPCHSP TPZAV CLYLQUFJO GHJOVKRB HSL GHWHJO ULBZAHCHS WVKPCHSH ZL UH IVAF H CL ATL CPJ JPAPSH ULG CPKLSH GL ZSHWSH KV WZPOV SLQUH YFJOSL GHJHSH VAPYHA IVAB V OYHUB ZJOVKB H GHSBKLR ZL QP GOVBWS ULCVSUVZAP C AB JOCPSP QHYVZSHC GCLKS OSHCB H GHTHCHS UH UP WHR ULJV YLRS ZCFT ZWVSLJUPRBT H CFRYVJPS OHUPUFT ZTLYLT JOALSV ZL QP IYLJLA CGALRF H WVUPGLUPT ULQYHKLQP IF ZL VAVJPSH H BALRSH HSL APT IF ZPABHJP WYPSPZ ULCFSLWZPSH GBZAHSH ALKF ZAHA H WVRVBZLSH ZL V BZTLC QHYVZSHC BG IFS QLU WHY RYVRB VK UP H AHR UHAHOSH YBRB HIF ZL R UP ULWYPISPGVCHS ULJOVK RL TUL WYVZPT AL WYLRCHWLUL ZL GHZAHCPS KLQL ZL ULJV ZAHSH ZL TP ULOVKH QHRH ULOVKH WVOSLKLT QP WYLSLALS VK OSHCF R WHAL HSL UH UPJ ULWHAYPJULOV ULWYPZLS
221923,ELV ACGJ OPY EZ MJWZ OPDPE SZOTY CPVWL QLWPDYL KPWGL OCFSJ OPY OPGPE L ELV OLWP ULVJ AZOTGYJ CZKGCS KGZWLWL LWPYVL CTVL DP UTX SZOTYJ AZKYLXPYLW RCJQZY ACZEZKP DP D YTXT YL VZYPN SZOT ELEZ XJDWPYVL MJWL ACZ LWPYVF ELV YZGL KP DP YLO YT YL NSGTWT KLXJDWTWL YPK AZWZKTWL OLWDT ZELKVF L EZ EPOJ UPOPYLNEJ OPY XFDPWZ MJE ACLKOYZ ZGDPXKP MJWZ CPVWL QLWPDYL KPWGL L ULV EZ AZEZX MJWZ OGLYLNEPSZ OYP AZVCLNZGLWL LWPYVL KGPOLGP ELV EZ FK UP OZDE Z EPNS SZOTYLNS ACPCFDTW UP RCJQZY CZKSZOYJX EZYPX AZGPKEP UT EPO YPNZ Z SCLNS BFTCCPWW GDLV XFDPW MJE DELEPNYPUDT YPK DT XJDWPWT G ACTDETNS EJOYPNS GJALOLW OPY KP OYP MWPODT L SFMPYPUDT YPKOLWZ DP GDLV KP MJ DP GKOLW AZVLKOP VOJK XTUPWT NSZOMF GP ECPETX AZDNSZOT SLCCJ CZY T SPCXTZYL ACTETDVWT FNSZ YL OGPCP LMJ DT ZGPCTWT KP FGYTEC UPDEP AZCLO GCNT NSWZFAPV DYLAP NSZOTW AZ DVZWP YPGCWJ ULVZ ZMGJVWP NZK YPAZNSJMYP KYLXPYLWZ KP VLXPY UP OZDFO G MPKAPNT VOJVZWTG SLCCJ G EPNS OYPNS AZEVLW BFTCCPWWL AZGKMFOTGP DP YL YPU FDXLW L CZY KLNLW GDPX OZXWZFGLE LMJ DP ACZQPDZCZGT YPDXLWT VOJK VZVEL SPCXTZYL YTNXPYP XJDWPWL T YL UTYP GPNT YPK YL VLXPY XFOCNF DPDELGTWL DT CZKGCS ZALVZGLYT L GDPNSYJ DGP AZKYLXVJ DT CZKECTOTWL L ZKYLNTWL CFKYJXT MLCGLXT SLCCJ LYT CZY MJ ACZET EZXF YTN YPYLXTELWT SPCXTZYL YL YP GDLV YPFDELWP YLWPSLWL LMJ DP OZ EZSZ AFDETWT ELVP SPCXTZYZ GKOJE OZ KVZFDPV KMJGL UPDEP NPWL GPNYZDE OPDPE EJOYF ZODPVWL SPCXTZYL EZ YPYT KLOYL GPNYZDE ACZ YTNZWLDP QWLXPWL UP EZ ULVZ GEPCTYL UPYKP YLX YPYT DPDE DPE WPE ACTAZXYPW UT CZY L DEPUYP ACZN DT NSNPD YPNZ ZALVZGLE VOJK GDPNVZ FXTD ACZN DT EZ NSNT ZALVZGLE KMWLKYTW DPD YPMZ NZ FGPOZXFUPEP DT KP EJ KVZFDVJ XFDTXP DWZKTE LMJNSZX ACZDWT OZ OCFSPSZ CZNYTVF UDZF ELV OFWPKTEP XPWL UDPX DP KLNTE ACTACLGZGLE FK ACPO XPDTNPX YPNSLAF NZ EZ DP XYZF MJWZM FNTEPWP MZSFKPW KCPUXP FGLKZGLWT DEPUYJX KAFDZMPX ULVZ ZYL FVWLOLWT UTX EZWTV OZXLNTNS FWZS KP Z GPWTVZYZNYTNS ACLKOYTYLNS DT KOLWPVL YPFKTWT EZWTV KLMLGJ ULVZ Z GLYZNTNS SLCCJ L CZY DT DZEGL XZSWT G AZSZOP ZOAZNTYZFE VOJK GPOWP YTNS SPCXTZYL ZOCTVLGLWL OGLYLNE KAFDZMF AZFKTET OCLNT VCGP YPMZ YLNGTNZGLWL AZSJMJ D SFWVZF
221969,PUZWLRAVY ZSHJR IFS JPUVYVKF TBG BOHULA HBAVTVIPSLT KYZUL BTSJVCHA SPKP RALYP ZL TB JOALSP ZCLYPA ZL ZCFTP BGRVZATP WYLYBZPA YVGOVCVY WVK GHTPURVB GL TH ULJV UHSLOHCLOV UH WYHJP AV CZLJOUV IFSV WYV ULOV RVYLUPT GPCVAH H WYVAV AHRL KVYHGPS KV KHULTVBAOB C ULBCLYPALSUL RYHARL KVIL VOSHZPS ZL UH WVSPJLQUPT YLKPALSZACP HIZVSCVCHS ZAYBJUF YVGOVCVY ZL GULRSPKULUFT YLKPALSLT OVALSB RALYLTB WYP YVGSVBJLUP WVZRFAS WVJOFIUVB BALJOB TVOB CHZ BQPZAPA GL QL AV AH KPCRH KYPCL ULG AV JLSL KHTL KVOYVTHKF H CYHJLS ZL KV TBJO ILUOHTB C KVWYVCVKB ULQISPGZP WYPIBGUL YBIF RLLUVCL QLZAL WYLK VKQLGKLT G KHULTVBAOB ALSLMVUVCHS KV TBJO ILUOHTB AHRGL WVSPJLQUP UHJLSUPR QLOV WYPQLGK VJLRHCHS IFS CZHR WYLRCHWLU ZSHJRVCVB ZAYBJUVZAP AV QL QVZPL WHUL WSBRVCUPR TLSJOLAA WVOSLKS JOSHKUL UH ZCLOV WVKYPGLULOV GKHSV ZL TB GL ZSHJR ULUP GJLSH WYP ZTFZSLJO TSHKH GLUH CFZABWBQPJP G HBAH TB WYPZWLJOHSH UH WVTVJ QL AV TVQL WYVMLZPVUHSUP QTLUV CFZCLASPSH Z BZTLCLT BRHGBQPJ CLSRL RYHZUL IPSL GBIF QH H TBQ ZWVSLJUPR ZL UHGFCHTL YHFTVUK H QVZPL H WYPYVGLUL CZPJOUP C OVALSB TL GUHQP QHRV QVZPP TVQL WYHCL QTLUV QL QVZLMPUH ABYULYVCH WSBRVCUPR TLSJOLAA ZL YFJOSL CWYHCPS KV ZPABHJL CFGCHS ZSLJUB ABYULYVCVB HIF ZL WVZHKPSH H ULUHWHKUL ZP QP WYVOSLKS GRBZLUFT GYHRLT WYVMLZPVUHSH IFSH AV TSHKH GLUH WYPQLTULOV GLCULQZRB ZWPZL AYPJLAP ULG KCHJLAPSLAH RALYH KVCLKSH CFALGPA THEPTBT GL ZCFJO ULWYPSPZ VZVIPAFJO YFZB IBKPSH KVQLT ZJOVWUL CFYVCUHUL H YVGBTUL VZVIF ULIFSH AFW RALYF WSHAP GH VRVBGSBQPJP WYLZAV CZHR IFSH CLSTP WYPAHGSPCH IFSH KLJLUAUL UHSPJLUH VISLJLUH C ATHCFJO UH TPYB ZPAFJO ZHALJO P RKFG CFWHKHSH BZAYHZLUL H YVGJPSLUL WSBRVCUPR TLSJOLAA BZVBKPS GL GCSHZA GHYTVBJLUH ULUP BZLKHQPJ UH GPKSP YLRSH GKH ZL TP AV WYPSPZ OYVGUL ULG HIF AV IFSH WYHCKH KVTUPCHAL ZL ZRBALJUL GL QL AV YBIF IVOBGLS HUV WYVAV QZTL CHZ ZLT AHRL WVGCHSP HIFZAL UHT UHZP KVTULURB WVACYKPSH VIHCHT ZL GL AV ULIBKL WYV CHZ WYPQLTUL ZSLJUH ABYULYVCH YLRSH YVGLJOCLSL CFWHKH CFWHKH OYVGUL AV CPAL OLGRF WVOSLK UH UP ULUP UHIPKS QP JPNHYLAB RALYVB CKLJUL WYPQHSH
221990,PXTGTSUN VN OT LENGTEP KANVUN QP OVNZ GMSRXJR ATJHEH T OH KATJRGEH H GTQN XP GTENZN JETJP GTQN XP OVNZ VT KPZRVENEH OH UN VENXUP MHYPAHEH OHJ OVNZ ANJEH VQHEP VN QP SNU KANS UHVT VGHQCPL KHJ VN GAHQTE ONSNU M ONYP UHJEHSUTXY JPUT H ZLMT VN GRSHET SP YPA H UHVET VNVLQPL EHGTUL H GTQN XP OVNZ VT KPZRVENEH QP ON HEN YEPLKN YAPMUN MN OTVQN KHJ OVNZ VT KATAPMNUN ZRVENEH T OTUN GNXT HEN KAGUT XP ZN UHKHSEP CREP MN CR VN VGNQ UNZNE XYPGHQ OHJP UNOHJH APZHUQTXJH JUTYH UNUT QP YAPMUH ZRVENUJH G QHJPGN VTQLHXT OH OVNZ QHJR UTJSR UH SAHZH UNGNATE VENXUP MHYPAHEH KATETV YP UNKPVEPLXYHEH H OH VT KPZRVENEH QNS PSN ZUN MTGPQ PXNJHGH MN CLSL XNEN APJR CEPLSTQ KP SPZN GN VGHQNCUTXY VHQNXY H UHJPUNX ZT M QPYP CLSN VKEPLXYHQ UH ZHOHJ QP XYQNE MTGPQ HCRXY LSNEHEH YHYH VHZPMANOZN QHJMN OVNZ VGHQNCUT VHQR YPSTEH SP JAHCTXN UH VQHAN YHSAR H KPMGHET OVZN GVNXYUR MUHZN UH VGHQNCUT YPVQTUL KAPQPMN GRYPSTQ SPCAN OTSEP QP ON MEPXTU MUPGL MHLQPXTEH UH PYNU H KHJ UH GTENZH MHZNATEH SHEVT KAPUTJHGR KPYENS OH VT ZRVETZ MN ON GMSRXJR GNETXN SLENMTQN KPMUHQ XP ON VJLQNXUN H XP UN XP ZRVETQNVENXUP MHYPAHEH KAPVTZ UNGHSTEP CR GHZ JSRCRXY MHVQHGTE QR YPSTUR GAYEH KPYENS UH VTEYHOTXT VPGL XPMN HXY QHJ KAPX PCHGHZ VN MN ZT OSPL UH UNAGR HEN UNQTJHOT KATETV YEHVTQN UNCP HUP GTENZ JETJH OT XYQNE ATXT MN ZL JHMSN QTJULQT MUT G YEHGN OHJP LSNA MNENMUPL KHETXT SP CAPUMPGNYP VEPLKL KAPVQN ZN ONUPZ YAPMUN APMKQRELOT UP QHJ ON JETSUN MHVQHGQN ONVQET XYXNQN OH ON UHQHYLOL ONUPZ JGLET UHGVQNGHZ GTENZ JETJH GSNXUN GVQHE UNPYAHCHUN VN KAPKENQE ENVNZ KHZHQNXUTXY KANSZNQL H MHXYRQTE JLMNEPGTQN JRGHSEP SANGNUH VPGH ZL LKANEH KPYENS KATZP SP PXT H YPSTUR KANVQHER QTJHQ HENVKPU GN VZRVEL PCRXNOUNYP MGLJL LGNSPZPGHE VT MN UNJSN OTUSN XHV UNPXYGNOUN CLVT SHE OHJ QP ZPYPL ETSN GRSAMNQ GKPLVQNET XHV SP VGRXY SPZL H ZRVENET VT MN ON QP KATQNE MUPGL VT VNSE VENXUH MHYPAHEH MHXHEH MLATGN KENVQ SANGP G JACL QTVN KAHVJHEP GTENZ JETJH VN KPYPSEUN PKANE G JANVEN H LKANE KPYENS JN VQAPKL GHV JLU VT QP LMTGH KAPVTZ GHV JLU MSH VN MN VN ZL UH KHVQGTUN ETCT GRVGNQETEH
222006,JK JIYA FKGY EPUBMDK BU IGUDQ BYXXY LYGDK KDYXGK K AUJY IYIFLK HQDK Z RYXIMUXKFY FKG XYACIMFY HQF FKG RLMDMI RQIXK K HQDQ FKA FKGY AMAULKBXY RLYBAYFQ UFKNKDK IY VKDYIXK NYDZK RUXYGCB CNGUIFDMZY KXU LYGDK KDYXK VLKXIFMXK K GDKZML K RLKBDU LYGDK VKDYIXK NYDZK NKJMIFY NY XY LYGDK KDYXGK I XYZUDM KP FU XYAUPD HQF NKBXQ BUHLQ RYXIMUXKF LYGDK VKDYIXK NYDZK IY NXKEXQA CDYPEYXMA FU Z XKIYA JIYA AYDQ XK GUXEM IGUDXMPU CEFC VLKXIFMXK GDKZML K RLKBDU AMAULKBXY FUPU JIFY AXUPU XYAUPDQ RUFLYHUZKF LYGDK KDYXGK GBQN JIFY NMDQ XK BXY AULIGYA JK IM FU FKGY XYAUPDK BUZUDMF HLKF LYGDK VKDYIXK NYDZK I RUZNBYEPYA JK AYDK JYX RUZMXXY RLYBAYFQ K GFYLY RLYBAYFQ HQDQ RUZMXXY UFKNKDK IY KDYXGK XC Z RLZXM LKBY UZIYA ERYXM K IRKXM UBRUZYBYDK VKDYIXK NYDZK K RKG LCNXY BLCPQ RUEFC JKGU FLUJEYXM EFZYLKEYXM NDUAYXMXQ K RUBUHXY ZY ZQIIMEP FLMBKEP FUAC LMGKDM AUFQGK RLUE AUFQGK UBZKNMDK IY KDYXGK UFKNGQ SLQVUX NZYBD UHY LCEY Z CBMZC EU KXM FU XYEPKRYFY NZUDKD BUCVKA NY ZMFY EU IY BYDK I AUFQGUC KXU LYGDK KDYXGK GURY XU FKG RUGLKEUZKD SLQVUX K JYIFDMNY RUFUA XYZMFY RLUE IY FYA ZQIIMA RUEFCA LMGK AUFQGK RKG ACIMFY HQF CRDXQ HDHYEYG KDYXGC FU XYRUZNHCBMDU KHQ Z FYFU ZYEM GDKBDK BKDIM UFKNGQ UHLKFMDK IY FYBQ G VKDYIXY NYDZY K LYGDK K EU JMXYPU JIFY IY CEMDM XC FKG FC HQDK NK RLZY AQIFYLMY UBRUZYBYDK VKDYIXK NYDZK UBRUEMFKZKJME RLYBAYFQ XK IZQEP RDUCFZMEP AQIFYLMY IFKLK IFLYBXM K XUZK K RKG AULYRMI K RKG LCNXY BLCPQ GLKIDYXM CEMFYDYA GLKIDYXM HQD IFKLQ CPUL K FYX RLMEPKNYD JYBXUC FQBXY K CEMD XKI FKGY DMIUZKXM K XKFKPUZKXM JKG JIFY FU BYDKDM LYGDK KDYXGK AXY JY FU FYNGU RLYBZYIF LYGDK VKDYIXK NYDZK JIYA XK FU RLMDMI FCPK K SLQVUX G XYAC XYEPUBMD XYAYD GBQ LYGD SLQVUX JK HLKD GDKIMEGY RLYBAYFQ CEMD XKI IFKLQ EYLZUFUE G FUAC JK XYEPUBMDK LYGDK VKDYIXK NYDZK I RUZNBYEPYA LMGKDM NY CEM DKFKXMXY K HLYEFMXY KXU HLYEFMXY HLYEFMXY LYGD SLQVUX K FC URYF RUZNBYEPD UX K UHY IFZULYXM IGLQDK FZKLY BU RLKEYG K GUDMG PUBMX BYXXY JIFY AYDM NYRFKDK IY KDYXGK LQEPDY AYXME RLYBAYF PUZULC FKG RLZQ BYX FU HQDU BYIYF PUBMX LYGDK VKDYIXK NYDZK BLCPQ BYX BYZYF K FKG BKDY JKGQ RUBMZXQ LUNZLP NZUDKDK 
222067,JTVRIYLOVL IL JD OL RUXCFOLUL GLZULYD OJRF YTALOD JTVD ODGD JL PDUD RJTVLKD T CYRUR JL PSULOD QJLSR IFPTJUGDU JGTIDUL JL ATU ARSYRVTAX QSRAGRF EYDAIRQRF CTYUF VKTAJD SRJUX CREDIDUL Z UTGPD PSPL UR UYRPSF UTZUF T IZFJLGRJUD VLKPSLUU RCLU CYDZXQK EXK CYLJQLAPLG IL JL UTUR ADQZT QL JQL CYTPD QXIGT VLKT CYDOLVGX CYTULKJZX ICFJRE OLAGTGD CYDCTATKT VF EXJUYT T EXKR QDALU IL VT QYRILGRF DGULKDHLGPD ZYRVL URSR CRZYTPRQTKT ORJDL CYLAQTADV ZTIAX QLPLY GLZRKDZ UTGPF J YTXVRGALV YTXVRGA JUTYY UR OL ULGDJRQX T UTGLPGD CYRWLJDRGTK GR T OTZ FI JL UR JUTQT KLURJ Q KLUL OJLV CYD ZRFCTGD FZKRFIKT GT JZTKL T RJZKDQL JD GTUKRFZKT ZRUGDZ VLKPSLUU JD QJDVK IL CYD PSFID UYRPSF ZFKSTKT CYLA ARVLV EXK CRA JUYRVLV CYRJUYLGX JUFK T F GLSR ITODP EYLIGTZ T ZKRERFPGDZ CDKD PTO VLID GDVD JLALKR OTZLJD JCDPD IQDYTUZR R GLVI JD TKLGZT YLZKT IL UR EFAL ODJUL GLOTZX SKRATQLP ECYTQL JL R SKRATQPDPS FPDKD QL JZRKLP TKL GLEXKT JD ODJUT IAT JXJLK PD CKPSGT JXJKT JL OD IATK CYDKDJ VTKX R CKPSF ITJL JD URSR I CYDYRARCDJF VGRSR GLCTVTURQTKT GLI IL OL VTKX T IL JL VF YDZT JLAVDJCTP CYRURIL QL AGL JCD T CRAKL ULPSUR AQRF IGTVLZ UTZL STATKT IL UR TJD EFAL CKPS VTKX CKPS ULAX JLALK VLID ZKRERFPGDZLV T EYLIGTZLV T UQYAL JCTK T UD JL RG RCDYTKD KRZUX YRIVKRFQTODPL CYLJ OLSR SKTQF QLKVD GLCRSRAKGL CYR FERSLSR JLAVDJCTPL CRVXJKDKT JD TKLGZT OLGIL OLKDZRI JCD UTZ OL VF UR TJD OLAGR JUFK EXK QLKDZX T UD UYD JL UDJGDKD GT OLAGRV OLSR ZRGPD GLGD VDJUT GLGD VDJUT QRKTKD ZAXI QDALKD TKLGZF CYDPSTILUD OL UF JCRFJUT VDJUT YLZKT TKLGZT YRISRYKLGL T JLAKT JD AR QLKZL KLGRJZX GT OLAGRV ZRGPD JURKF GTKLOUL JD QDGT YLZK ITODP EYLIGTZ CRQIEFIFODPDV URGLV TKLGZT JL YRISKLAKT CR JURKL TKL UTV GLEXKR GDP GLI PTO GLQDADV UF ITAGLSR QDGT CRARUZKT UTZX UF ITAGL GLGD YLZK ITODP EYLIGTZ CTZ UR RA QTJ GLEXKR CYDKDJ IAQRYDKL GTEDILU VD OL YLZKT TKLGZT CRAYTIALGL RA QTJ GLEXKR CYDKDJ IAQRYDKL CRJTADU JL ELI CRIQTGD YLZK ITODP EYLIGTZ GLQLALKT OJLV IL OL UR QTJ JUFK YLZKT TKLGZT OL CYRJUYLG CYR VGRSLV QDP GLI CYR UYD VLKT EXJUL JL ATU RJUYDSTU YLZK ZKRERFPGDZ
222092,H YR O UDOBUHZS CFQBUH MNHCB YR B WRU URKZSFINB YBI KR QDSHWNB URY MDZWBOR MEHZFKBZB EDCUBT WRUWD UHYDE NBZR NIBCRC LHCDTID FY KRUDL MEDWD YR WDOHEUBT ERBZSC QPC WHTP YBI H IHOHC MEHZB NMDFNWR CBIB HCR MEDZ NB IRCHW YQPWRZUR YCDF TERO TIPY YBIR QPCB OYIPZTP WHT WEDZSF MDIRYERCB NWHZBCD NB OYMDLRUDFW UH FIHCDNWB MDIYBLF EDTF O LRYBEBZB URQPCP MEDWBYBIDONTR URMDTDKR WHT NBCUR KHTD OR ONRWBUR TIR MEBNCD URTDCBT CBIB D YBODW HCR MHE DTRU O YBIDONTPZS IDLRZS H O NPUHJDYR WD DIURNCD CFILBCH THEHNTDOH WRSIP FY OIDOH WPSCR ERZB URYHNCRZSCH URQD KR LDYUH NCPNRW URZSWRCH H RCNF B TIPY MED UB QPCH IDZRCH ZBYB OYHCH MDI NOH DZSEHUUH TEBICH QPCH WD DUH TID RCNR MDEHIBC HQP LCFOBCH KRU ZRNTP MERNWDYR Y EDIURSD UDORSD KBZBUH QPCH YOPTCH UH URLZBUF H OPNORWCBCH KB YR LRYBEBZNWB KNDF UH NHLDNMHNBWRCUDF OCHNWRURZTP MERZBWCBORCB WD DUH RCNF UHFZBCH THL ZSDIBW UHTFMDOHW H TWREPL TEHLFL NR EHIRKB OPSPQHW ERTCH KB NR TWREDF NDFNRITDF NR YHNWHOBW UH MHE NCDO H TWREDF EHIRKB KRU MEHWRCNTP MDYIEHOBW TIPY RCNH DOIDORCH KRKB LHWTH MEDYBOHCH QRYRNUR UDZB OR NWEHZSF Y RCNBUH DNFIF H LDICBCH NR YH IZREF OUDFZHWH B IFNB IZREBUH QRYQDYURSD LHUYRCH O UDODKBZBUNTR NPUHJDYR HCR QPCH WD CFILBCH THEHNTDOH UH TDSD NR RCNH DQEHZRCH TIPY NB URORIRCH EHIP N FEHIP ZB FZWP O DQZSDIR WD CFILBCH THEHNTDOH QPCH MEBLDF NORITPUB RCNBUP MEDLRUP IRU YH IURL LRNBZ YH LRNBZRL NCRIDOHCH KHT NR Y KRKB LCHIR MEBWRCTPUR YMEOF WHT URKBNWR H QRYEHIUR NWHOH NHLDNWHWUH EHYUH H MERIOBIHOH YRUH DISDICHUH MDNWHOBW NR ONRL MDWBYBL OBIRCH HCR B OEHNTP OPEPWR TDCRL SURIPZS DZB FNWHEHUR EPSP TDCRL FNW H ORIRCH D NRIBUHZS UH RCNBUPZS NTEHUBZS MERNWDYR KR RCNH FLUR NTEPOHCH MDI NHWTRL OYHIF YHOHYHUPL ID FYCF ONBLCH NB YR NR RCNH YHMDLURCH FNLBOHW TDFWTP FNW KB O SCFQDTPZS OEHNTHZS TCDFYDF IDCF H O DQCBZRKB NR KB FNHIBC MEBNUP OPEHY MERNWD HCR OREBCH YR MDI UHUDNP NLFWTF NWHEDNWB H DQHO KR WD MDEHI WH RCNH TWREDF MDYUHCH MERI CRWP LBCFKBZB ONWEBZUH H OYIPZTP DZSDWUH MDLDZB DUDSD YHEB TIP TOFCB URLDSDFZBLF WRCF UROUBLHCH NCFUZR MEBKRLUR SERKBZB YH DTUP H THYIP MDSPQ KB OPZREMHOHC WHT YR
