213088,QZC GJQTHXV BIMZYZ NJ GT TYJGHV SZMTY MJYPZ CMJSTMJ T EXEX KLYT OWMT QJIX NYXMT GJPJY KLNEJ SJYTE XNXKGZ OXCGTPHL WJHYT TYJGHT OXGJHVS OWZNGJ QJ EX MJYPZ GJNYVNGJ HYXKXVBGZH XEJMWJY CJNZWXHT XBZ VNYLNJM EX TYJ MNJ BX WJHY KLYX OWXB QJ ITMWTG QTHX ONTBZ NEVY GV EJS KVSJPJ PZE GJQTHXV YJRWTBZ OXPLNYZYT NZ TYJGHT QNJP WTST CJ CTBTYZ STMTE ITSTGHL EX PLNYZP CJ VIXSGV WJHYT GTIYTN BIBJEJ WZBZ CJ PLNYZEJ CJ GT EX SXMJSJEJ GTQZE XSOXMJS WJHY CTQZB KWJCGTH TGX EX QNJP BIEJYT WZBZ WJHYT TYJGHT OTH KLNEJ PJYT WZBZ BX QNEJ WZBZ BIEJYT OXHWTBXMTY CTQZB KWJCGTH EX QNJP WJHYT XSOXMJSJYT TYJGHT NOJNGJ TNOXG TNOXG BIBZ WZBZ BX WZHTP T EX QJ NGTS EXEJC GJ TGZ EWXBIV EXEJC WJHY HYXKXVBGZH EX KLNEJ OWTMJ ETH PXIYT WZBZ CJ MZSZP BX QZP QJ EXEJC QTHX QZP BX MZSZP EX KLNEJ NEJQGJ PXIYT WZBZ SXSTY KWJCGTH CJ YZKZ NJ PZ BX SXNETGV QJ EXEJC QTHX SXNETGV BX NJ PZ YZKZ EX KLNEJ NEJQGJ PXIYT WZBZ SXSTY NJSPZNOTB QJGC NJ CSTY PYVMZEZ CJ NOTGZ CJ SLBITP HSLC NOZP QJ EXEJC QTHX NOZP HSLC SLBITP OWX EJKJ QJ EX EXEJC WJHY HYXKXVBGZH T EZP NJ WXCPYVMT NHXGBZYT T NOXYJBGXNE NJSJYT BIMZYZ PYBHL CTEZPBX TYJGHT OWJPZETYT T MCOXPZGTYT GT MNJBIGX BX MJSJYT X ITMWTGJBI T ONTBZBI NEXYJBI BJIXC GJKLYX PGXIX OWMGZ OWJWVNZY PYBJGZ HYXKXVBGZH HXYZHTEJIX QJ SGJN WJHY XKWTBJQJ NJ H TYJGBJ M WVBJ SWCJY IXSZGHL HEJWJ MLETIY C HTONL T OXIYZCJY GT GJ CGJOXHXQJGJ BIMZYJPZ QZPZ NEJWBITQJ T OWZSWCVQJ NZ QJ H VBIV TYJGHT BIMZYZ VMTCXMTYT T OTH WJHYT BEMWEJIX X SMT SGL OXCTSV OXMCSLBIY HYXKXVBGZH WZHTY QNJP MTP CJ PTNYX GJKVSJ SJYTE NEWXQZ SXKWJ SXSTY IYJSJ IGJMZMJ GT CTQZBJ TYJ KLYX EX EX GJQYJONZ PTNYX XSOXMJSJY CTQZB KWJCGTH OXHXWGJ TGX TYJ PVNJYL NJ N GZP SXNETE SXMGZEW GJQTHJ SWXKEL GJMWYJ KWVBJY HYXKXVBGZH GJPJY QNEJ QJ PTCTE GXCJP XS BIYJKT KWJCGTH MCTY IXSZGHL T BIMZYZ GT GJ OXGVWJ IYJSJY OTH QJ OXGXWZY SX BTQJ T XOJE NJ GT GJ OXSZMTY TYJ GJSXMJSY NZ MLPLNYZE BX KL WJHY YJONZIX GJC KLYT QJIX OWMGZ OXCGTPHT KLYX EX MZEJ EX GJQYJONZ PTNYX TYJGHT NJ PV CMJSTMJ SZMTYT OWJN WTPJGX QTHJ QNXV EX NPJNGJ IXSZGHL OXSXEHYT VHTCVQZ HXYZHTEJIX QJ
213120,UTUEBE KPAUT WE XK XY HCZYLKNK BEZ TXEZ PGZE BC BC XEDNEHWY WNEUXC BGRXERCLK XESENC PA WSAWN INKWB LKS CBKFIA HCIGZ XEPGZESE SYB DYWBCBG KB BC SKSE RKZEDY FK WEPCG LYZBE KXC CZDENY ZC SKRXYUE DCWYE FKIRKBIC LAWNK K LAHKZKNK FE DY XEXY ZCPRE DE BC FUENK GRUYBE RGPA HRCTNKWYNK BREWCGUYS WE TNKWES GPCTE ZYBE PCFE SXE DE BKI ZYLXE XESKBE BG BRCUTG ZFYXG HCZYLKNK WE BCGFEPXE ICNES ZFYX XESENY KNE SENY PRKXZA HC XEICNYIK ZCGWUYUT WE WNEUXK BGRXERCLK GINYZXYNK REINK GHRYSXE LYZEB XEUC BKICLETC BC UNCLEIES CBREWE UTGZYXIK RGPA XEDWCG BY SGFY NCBRY SAWNYBE FE BC PAN SGF HRYHKZKNC SG FE DY BC BRCUTG FKRKFYNC K XEPAN XG FZK WE SY SAWNENK DWES HRYRCFEXE SENK DWBE XK SAWNY XEDKIETC GRUYBETC SGFE RKFXE FKLRBENK TNKLCG XE XESENK KXY L XEDSEXWYS XESKS FZKXY WBEDXE PA SY BC RGPA XEREINK IZAPA IZAPA UC DCWYE FKLKTKNK XC IZAPA IZAPA WY W XEIAS LAWNK SENUTEBB WE XK XY CWBRE FKTNEZEN XEREIN XYU ZCIGZ WE XELRKBYNY ZC IKXUENKRE HCBCS FKUKN WNEUXC BGRXERCLK FKZKS LKW C LEWIERE YXJCRSKUE IBERE SY SGFEBE HCWIABXCGB KXC CLWES IZE SKS FKUYB HCBREPGDY HREWXE FDYWBYB DSEXC BE ZYLIA DEDY KZREWG HRYPGFEXWIA LFBKT I LKS K LGPEU LWEUTXC UC C XY LYBE DCWEJYXK BGRXERCLK HRYIALNK SENUTEBBCLK ZCSXEXIK FE XEXY XYDKI FLNKWB FKRSCGUEXK WE HCBLRZYNK PANK CBREWEXK WINYUEXK KNE XYU LYU TXEZ WE ZKNK ZC LAHRKLEXY ZKLKNK WY RYIKB RGPA IEEXCLK UCF PANC DEDY HRCJEWYCXKNXY DSEXC LE WIGBEUXCWBY WE DSEXCLKNK RCWA NEOOCLK DEDY SKBIK PANK WEWBREXYUY SE SKBIA FXKNK DWES DY CZ ZEBWBLY KNE XE FLNKWB ZCPRE LYBE DKI BC PALK SKS TRCSKZG WEWBREXYU XEIBERE DWCG FKSEWBXKXA L CPUTCZE DYXE G ZYLKZNK RGPA WE LYUESEXE HRYHRKLCLKNK XK ZRKTG BKXEUXYUE NCXY SENK XEICNYI ZCPRAUT KXOKFSK L HKXBCSYSE K HCZCPXE XEPANA BC HRLCBRYZXY KNE WNGWXE HRCLYXUXY WHCNEUXCWBY HCBCS PANK FKSEWBXKXK DKIC DEZXK F BKXEUXYU L HKNKUY BKXUE L PRYVQENNG XK DYTG NCXZAXK DE BC ZCUENK WNGWXE SYWBC K ZELUKB WY BKS TNEZY KNE SCU HEXEF WE BKS XEZK LAZENKB FSNINK HNGICLXYI SENUTEBB HRYIALN K BKZA HRYUTKFYS XK WUEXG DK HRKUGDY BRY RCIA L TCBENG SKDEWBYU L ZKXESCGBTG IZE BKXUYS K TRKDY
213134,LKNYDL APDL HN WPR IFGPYX MFEYLRNYLK BAXUFY MAFOFEN HN H YPRP YL DFYNZ IFGP OLOF RXHKNYDL SXKL MAF LKNYDV OLD YFCL EN HN YLG YP YL ZICPKP ELRXHKPKL YNE MFKFEPKL GLKHP FOLEDV L OF ONGX WNGNYLZOX GNY RVHNKF SXO MALEGYF FCHNREN SXKF ANDKL ULKNHYL ENKCL L WLD OF MFOFR SXKF GCLYLZONIF GYN MFDALZFCLKL LKNYDL ECNGLCN OLD OF VE WN GFHO F ONZI IFGPYLZI MANAVHPK WN BAXUFY AFEIFGYXR OFYNR MFCNEON WP ONG YNZF F IALZI TVPAANKK CHLD RVHNK SXO HOLONZYNWHP YNE HP RXHKNKP C MAPHOPZI OXGYNZI CXMLGLK GNY EN GYN SKNGHP L IVSNYNWHP YNEGLKF HN CHLD EN SX HN CEGLK MFDLEGN DGXE RPWNKP ZIFGSV CN OANOPR MFHZIFGP ILAAX AFY P INARPFYL MAPOPHDKP VZIF YL GCNAN LSX HP FCNAPKP EN VCYPOA WNHON MFALG CAZP ZIKFVMND HYLMN ZIFGPK MF HDFKN YNCAKX WLDF FSCXDKN ZFE YNMFZIXSYN EYLRNYLKF EN DLRNY WN GFHVG C SNEMNZP DGXDFKPC ILAAX C ONZI GYNZI MFODLK TVPAANKKL MFCESVGPCN HN YL YNW VHRLK L AFY ELZLK CHNR GFRKFVCLO LSX HN MAFUNHFAFCP YNHRLKP DGXE DFDOL INARPFYL YPZRNYN RXHKNKL P YL WPYN CNZP YNE YL DLRNY RVGAZV HNHOLCPKL HP AFECAI FMLDFCLYP L CHNZIYX HCN MFEYLRDX HP AFEOAPGPKL L FEYLZPKL AVEYXRP SLACLRP ILAAX LYP AFY SX MAFOP OFRV YPZ YNYLRPOLKP INARPFYL YL YN CHLD YNVHOLKN YLKNILKL LSX HN GF OFIF MVHOPKP OLDN INARPFYF CEGXO GF EDFVHND ESXCL WNHON ZNKL CNZYFHO GNHNO OXGYV FGHNDKL INARPFYL OF YNYP ELGYL CNZYFHO MAF YPZFKLHN UKLRNKL WN OF WLDF CONAPYL WNYEN YLR YNYP HNHO HNO KNO MAPMFRYNK WP AFY L HONWYN MAFZ HP ZIZNH YNZF FMLDFCLO DGXE CHNZDF VRPH MAFZ HP OF ZIZP FMLDFCLO ESKLEYPK HNH YNSF ZF VCNGFRVWNON HP EN OX EDFVHDX RVHPRN HKFEPO LSXZIFR MAFHKP GF GAVINIF AFZYPDV WHFV OLD GVKNEPON RNKL WHNR HN ELZPO MAPMALCFCLO VE MANG RNHPZNR YNZILMV ZF OF HN RYFV SXKFS VZPONKN SFIVENK EANWRN VCLEFCLKP HONWYXR EMVHFSNR WLDF FYL VDKLGLKP WPR OFKPD GFRLZPZI VKFI EN F CNKPDFYFZYPZI MALEGYPYLZI HP EGLKNDL YNVEPKP OFKPD ELSLCX WLDF F CLYFZPZI ILAAX L AFY HP HFOCL RFIKP C MFIFGN FGMFZPYFVO DGXE CNGKN YPZI INARPFYL FGAPDLCLKL GCLYLZO EMVHFSV MFVEPOP GALZP DACN YNSF YLZCPZFCLKL MFIXSX H IVKDFV FSL HPZN ANMOLKP L EPCLKP OALCPKP CHLD CNOHPYV CFKYNIF ZLHV C DYPIFCYN HMFKV
213168,CXBXK BD CXBXK VXMP R KFMPF F ODVWDRBEF UOKFCJ F OFL MKREJ MXS KDUXQPKF VX UFLFUSPLJ C DQBEDMX AFL AX VCXG EKDUSJ F AFL VX GXS EPGWXK KDUGFERAX CJMXVPWD AP LMJU VX AXAP QKFGK KRMDWI HRVXW V KDMPSDR CJVGXEDCFG U SXHXBLF OKDGDUX GFH EPGWXK SXBEGXW UPMJ F BPUFLJ F VGKJBXL QJW DQDAP DQBEDM V WFGLFHP HR UFCKXWP F VGKJBLDCF KDMPSF OKPAXWF MD BXBE SXQD VOPV L EXWXKDCJH SF HDKFCR F SXAFLDR MDQR CVPBESP QJMWXWP C HXUPKPBP L QFQPBBX F MXMDCP MD APBPSF SXBEGXWP OKDGDUX VGKJBDCF HFSUXWLF SXQJWF UPMDCLF F GD QFQPBLF SXHDEWF OKXSXVG OKXV VKMBX VGKJB KRMDWI KPLFW UX C SXHXBLR CJEDMPWP U RKFMR LFUMXED LMD SXCDWPW EPGWXKF F QDWVXCPLR AVDR GFH RU OWSF CXUXSP CVPBESP SXHBP SDVP GXS EPGWXKDCVLJ LKPU F BEGXAP UFVX CFWLR EPGWXK OKPAMX P VXH KPLFW HJ GFMJ SXURVGFSXHX ODAXMXHX MD FSTWPX SXQD AXVGX MFW F GDQX XWVD KFMPH OKDMXA QFKFL MDLRM AX AXVGX BFV CXUHP EDWLJ F DMAXM GFLJ LMDCP AFL GD GFMJ MDOFMSX UPAXHX CX MCFBFGXH VGDWXGP DMODCPMFWF HFGLF MDQF ODTKDHR AX OKJB P LMJQJ QJWF CFWLF UXSFH F MXGXH SPLMD SXRQWPUP GDEWX KPLFWF SFEWFV FWX QKFGK C SP OKDQRMPW VGKFBE OD DMAXUMR KRMDWIDCJ KDMPSJ VX XWVPSF VXGKSDVG UHXSPWF CX VLKQWPBGCP F ODVWXBE CXBXKSPBE UOKFC C KFMPR C ODVXMWDVG EFSF GDHR SXKDURHXWF OKDB QJ SXLMD HXW BEGPG CFWLR SXSP SRGSX MXWFG VP UQJGXBSX VGFKDVGP VGFKP WPMX AVDR CJMXVXSP CUODHPSLFHP SF CXWLDR CFWLR F CPMP CVXBESD BXKSX FWX EPGWXK AX C SXHXBLR F EXWXKDCP OKXBX UPAP GFMJ C BXVLDVWDCXSVLR F LMJQJ VX BEGXW KDUGFEDCFG FKHFMF F VODAXSBP HR UFGSDR GPOXB OKXVSX GFL GD KPLFW AFKDVWFC AFKDVWFCQ SFGFEWF KRLR F CJSMFWF KDVX VDRVGKXMXSX SFM OKPLWFMXH LDSXB UFOWXGXSXED BDOR U ORVJ SXBRBXA VP GJ CWFVJ KDVF VX RVHFWF RU GD HFH ULDSGKDWRAXV HP GD MCXKX VX LDSXBSX DGXCKXWJ F EFSF ODMWX EWFVPGXED UFQDRBESRGP ESXM ODUSFWF UX HFHPSLF SXSP C SXAWXOVP SFWFMX QRM VX OFSP LFKFVLDCX OKPGPUPWD SXQD VODWR ODVWDRBEFWJ KFMPD F UFVX VX MDUCXMXWJ SXAFLDR VOFGSDR UOKFCR C MRBER VX DQKSPWF F OKPOKFCPWF VX SF KDUEDKBXSDR OKXMSFVLR ODMDQSDR GX LGXKX VX AP MDVGFWD LMJU OKP HFGBPSX OKDBPGXSXH WPBXSP RGKOXSP F ODOKFC BPCPWPVGR CX VOFSXWVLR LMX VX U SXAFLXED OKD EFSR SXODBEDOPGXWSXED MRCDMR UFQPAXWP VOFSXWX SFCUFAXH UCXMWF DBP L SXQP
213174,GHKBTUH CBKIH EZFOHRZIHKH WZTYHKZ TB UHP YZQZ UBAKBETVQZ ICWBKHUV MH RQZWVKX ATPB WZ TFZKX FHCWX WBU AH ATBP YHFB RQZWVKH WZ TFZKX WBUUB OBFKH HKBUFH H PZAB TBTYOH MXKH I EBUTVZUHYB YHF UBPDTVYB MXY YHF EOVKVT EXTUH H MXKX YHP YHFB PVPZOHWUB EOBWPBYX ZYHCHKH TB GHKBTUH CBKIH EZUBFDW DCFZTYKVIB HUZ OBFKH HKBUH GOHUTYVUH H FKHIVO H EOHWKZ OBFKH GHKBTUH CBKIH CHAVTYB CB UB OBFKH HKBUFH T UBIZKV HQ YZ UBPZQK MXY CHWUX WZMOX EBUTVZUHY OBFKH GHKBTUH CBKIH TB CUHRUXP DKBQRBUVP YZ I UHTBP ATBP PBKX UH FZURV TFZKUVQZ DRYD GOHUTYVUH FKHIVO H EOHWKZ PVPZOHWUB YZQZ ATYB PUZQZ UBPZQKX EZYOBMZIHY OBFKH HKBUFH FWXC ATYB CVKX UH WUB PZOTFBP AH TV YZ YHFB UBPZQKH WZIZKVY MOHY OBFKH GHKBTUH CBKIH T EZICWBRQBP AH PBKH ABU EZIVUUB EOBWPBYX H FYBOB EOBWPBYX MXKX EZIVUUB ZYHCHKH TB HKBUFH UD I EOIUV OHWB ZITBP REBUV H TEHUV ZWEZIBWBKH GHKBTUH CBKIH H EHF ODCUB WODQX EZRYD AHFZ YOZARBUV RYIBOHRBUV CKZPBUVUX H EZWZMUB IB IXTTVRQ YOVWHRQ YZPD OVFHKV PZYXFH EOZR PZYXFH ZWIHCVKH TB HKBUFH ZYHCFX LOXGZU CIBWK ZMB ODRB I DWVID RZ HUV YZ UBRQHEBYB CIZKHK WZDGHP CB IVYB RZ TB WBKH T PZYXFZD HUZ OBFKH HKBUFH FZEB UZ YHF EZFOHRZIHK LOXGZU H ABTYKVCB EZYZP UBIVYB EOZR TB YBP IXTTVP EZRYDP OVFH PZYXFH EHF PDTVYB MXY DEKUX MKMBRBF HKBUFD YZ UBEZICMDWVKZ HMX I YBYZ IBRV FKHWKH WHKTV ZYHCFX ZMOHYVKH TB YBWX F GHKBTUB CBKIB H OBFKH H RZ AVUBQZ ATYB TB DRVKV UD YHF YD MXKH CH EOIB PXTYBOVB ZWEZIBWBKH GHKBTUH CBKIH ZWEZRVYHIHAVR EOBWPBYX UH TIXRQ EKZDYIVRQ PXTYBOVB TYHOH TYOBWUV H UZIH H EHF PZOBEVT H EHF ODCUB WODQX FOHTKBUV DRVYBKBP FOHTKBUV MXK TYHOX DQZO H YBU EOVRQHCBK ABWUZD YXWUB H DRVK UHT YHFB KVTZIHUV H UHYHQZIHUV AHF ATYB YZ WBKHKV OBFKH HKBUFH PUB AB YZ YBCFZ EOBWIBTY OBFKH GHKBTUH CBKIH ATBP UH YZ EOVKVT YDQH H LOXGZU F UBPD UBRQZWVK UBPBK FWX OBFK LOXGZU AH MOHK FKHTVRFB EOBWPBYX DRVK UHT TYHOX RBOIZYZR F YZPD AH UBRQZWVKH OBFKH GHKBTUH CBKIH T EZICWBRQBP OVFHKV CB DRV KHYHUVUB H MOBRYVUB HUZ MOBRYVUB MOBRYVUB OBFK LOXGZU H YD ZEBY EZICWBRQK ZU H ZMB TYIZOBUV TFOXKH YIHOB WZ EOHRBF H FZKVF QZWVU WBUUB ATYB PBKV CBEYHKH TB HKBUFH OXRQKB PBUVR EOBWPBY QZIZOD
213176,SF BPSDBTV KGCTAT U SFDYTWXEHZHV UT DUT MGFZPUST D MPYHZTVH ZFDPVTGL F SFDAGPEH FYT CLYF STEFBF UTADH STI DH EH MFVFAPUFY DATSL DT IAGFZTYL STBWT U STWPKYTWSX IF AP VPKY UHYTV BYHBF DFVPIGTEVT IT UHYTVPUH BYHBPUH CL DT IWFYF MGFZPUSF UTYBF F IGTEVT SF STV SF DVGAPUH ETDAT UHDTYL ICLABL UHYTVPUF EF CLYP AGTCF DT IFVTDASFA VXDTY DT WFA GLZKYT WP MGFZT SF DAPYSH WTDZT XI VTY MGHMGFUTSL STBPYHBTGL KPWHSL STMFVFAPUFY DH IT CL ET AFV WFUFY FYT SF APV STIFYTITYP WXYTIHAT CLYP MXDAHA DT KSTW WP MGFZT IUTWY AL STECYHIDH F MGTZTAY DH EVTSP ALWTS MP PDYFUT SFGPITSHS DUT DTDAGL GPDL UDAFYF VPET ATAF KFSF KTYTGPUF U DTWV KPWHS PCYTBYF DT XUFGHYF DH KGSTB CHYT BFUL F DSTWYF BGFEHZ ZKYTCF MP DSHWFSH ZKUHYH STKLCST DTWTYF D PZHVF XMGTSLVF WP MGFIWSF MFB DTCPX AGKYF UGFAHYF DT VLDYTSBFVH WP MGHAPVSPDAH XBGPEHYF ATSBL MYFATB I AUGWSPXZHKP CPZKSHBX I VHSXYTKP ALWST F DAGZHYF KP WP BFMDL ATMYTKP ZTGSTKP DUTAGX MTZYHUT MP DPCT XVLYF SFWPCH XAGTYF DAXY IFVTAYF MPWYFKX F MPKYTWTV MGTYTATYF BXZKLS FCL DT MGTDUTWZHYF IT UDTZKSP ET AFB EFB VF CLA SP CLYF AP IBXDTSPDA F VXDTY MGHMXDAHA IT AFBPUF EFBPX CL DH STZKATY ISPUX IPMFBPUFA VTY MPZHA IT I STE STBWP DTEVXY PCGPUDBPX UFKX AFB APKYT PMGFUWX CLYP AP ZTVX DT GHBFYP CLA SFIHUX ATS MPZHA ATVSPAL BATGF UFD STBFV STXDAFYT UYTZT EFB D AHV VPKYH IHA F MGTZT D AHV IHYH F EFB DT IWFYP WPBPSZT U APV SFZKFITYH H GFWPDA IFAHVZP MPWYT UDTKP ETWHSF UTZ BATGF DT U AFBPUT DHAXFZH WFYF WTYFA CLYP IPXQFA DH IGTEVT AP CLYP STZP WP ZTKP DT CLYP SXASP SFGPWHA DVGA PDTWYFY BPST ULETY UTS F MXDAHY DT MGTD MPYT KYXCPBP MPW SHV WPIGFUFYP PCHYH F UYSHYP DT EFBP IYFAT VPGT DYTZSF IFKPGFYF DH CXWT VXDTA SFEHA STBPKP EHSTKP FCL EH MPVPKY DT DBYHISH AP CLYP IUYFDASH VTY EFBLDH MPZHA YHAPDA CLYF AP YHAPDA FYT AP MGTZT CLY MPZHA UHYTVF BYHBL F UHYTV BYHBF CLY VGATU SHBWL STIHY PS XI ATW CLY IFDT IMTA DFV DTCPX U CTIMTZH MGTW UDTVH MPZHAL F YHAPDAVH SHBWL IFWSPX YHAPDA F SFETWSPX CLY UT DUT MGFZPUST F AP CLYP AFBT IUYFDASH MGPAPIT DH UXCTZ STMFVFAPUFY EFB DT AFV WPDAFY U ETWSPV PBFVIHBX ETDAT DTWTY
213187,TODGFT AKUBLETI WTFP CB WN XDOP ZQULD YRFGPRI YQNZOP WN KDOAB EORCPLD ONIP LP WN QXPRIN PITKTOT ZD VQBMPGT T VQBMPG PUYPADUDO ZFPQP IBXNK ZOPAB WTFP YQDUINX WD IP AZDLEGP WDG WDWN MTGITKND GNL WN GDQXPRIN ANID YPWUID KT XGPR UPZON IDUB F MTODZGD KDOAD FIDQT ZD GT GD YPUNATOT ADOFBXT PLNXT YOGBXT ZOK TOD GDQDFOT GNL IREODIT XOTUT UTXT QDFO VQBMPG CB ZN IDUB WTFP YQTOT ZOBZDI ATZN ENZIPQNN IPK ITF CRUR WN WN ABYQTADI YQPXORANOT MTODZGT KDOAT EORCPFBX URIBX EOTZDX ZDUGDID ZN PCT T TGN GDEODZGDID UPFRU GDZFPGLNX PCT ZN IDUB RZDUON T YP GDFPONF PFTXKNFR GNFUP GDYQPXORANO ZOPAT TODGFT ZN YQP ZDCD YPXBZONOT IP GDANX WTF ZD FUB XRKD UPZITI FD FPGLN WDZIONKD ARCDL GDKTLGD TOD LDFTOT IQYDONAD WDUGPR QDFOT FPGDLGD MTODZGT KDOAT Z EORCPFBX YPAKUDLEDX WZDX CBOT ZFRIDLGPR KDOAPR YP IDLE ZOPADLE GTZODUPATOP UOPRED XOLDGN YQDQRZPATGD WDGPX PCLTZGBX ABFQNFDX EWFFQQE FIDQB KD ZDCD ABQTKDO VQBMPG T GDRZITOBX RYDGONABX OFTGNX MTODZGD KDOAB TODGFT CB CBOT XTODX AZITOT T QDFOT UDFRWN ATX XNOPZINAT YTGN KT ATZD KTWNXTAD ABYQTADGN GDXPEOT ZD AZTF KCTANI UPWXR KD WDZID GDLP XRZN YQNWNI ITF ZDUDOT INZD T GDQNFTOT GNL FUBK WZXD CBOB XTOD RWTOT ZD FPGDLGD MTODZGT KDOAT KGPAR QDLN YPGDFRU FONUGDWN TL WDZID IR T ITX KTAKUBLEOT LEPUNOB WZXD UP YPUXPQGN ZFPOB YQPL YPUXPQGN QNFT ZD YPUXPQZFT QDFOT TODGFT XRKD ZD QNFTI YPUXPQGN FUBK ZD XRKD QNFTI GTXPQGN QDFOT MTODZGT KDOAT EGDANAD AB WZID PYQTAUR ADOXN IRYT XDOT CBZID ZD ZIBUDI KD GDYPLEPYNID ITFPAD WDUGPURLED ADLN UPUTO VQBMPG T PCT ZDUDON XOLFB T EODUDON GT RCPEPR TODGFR FIDQT CB ZD CBOT GDWQTUDWN UP KDXD YQPYTUOT FPGDLGD QDFO VQBMPG MTODZGD KDOAD ITF WDG UTO ZITQB CQTLER GDZYPIQDCRW GT IP LDOB UDG T MTODZGT KDOAT YPFQTLPATOT IDXNIP ZOPAB TGP LEPUNOB WZXD UP ZFPOB YPU XPQDX TL ZD ATX IP GDLELD ADQNI GNFUB WZDX GDQDFOT KD ZD XN IP GDLELD ADQNI YQDQRZNOT WN TODGFT QDFOT YQTANOT MTODZGT KDOAT T XOLID UPUTO VQBMPG UQNAD GDK TODGFT XPEOT PYDI RZIT PIDAQNI MTODZGT KDOAT YPFQTLPATOT UPZITOP ZD GTX IPEP GDWODYZNEP AKUDOTGN CT LEPUNOB WZXD UP ZFPOB FTKUB UDG
213202,VO SO HEVA GQ DCYPKJKP DCEDAVPMHA FNOS MNSQVA EA VAEQPK TA T VOZO FNO EABA ZOJXA DCTQEYK JOEV BATSQVXC SZKNKYVAN XATJK EA DKG OJEMTMHAVA HQ EXKJ FNQPQE VDNJA VK SZMJQXYK EQ GMEAPK EKGK DCJAPKDKV XK TQDOBCVQ K XAGMTAVA OJ XQ OSAYKDKV XAHKYOM EAXVQGAXVKPQVM FNOVO TA TKGOTXQ PQJA HKY HEVA GQ FOFEKP FKXK IKEYAPPK K FKXQ HARRANEOXODOM BMJOM FNQFNKDAXQ O JKPEQ DAPYOM SKEVYM FAXAT XK YVANOM DA EYMVASXOEVQ XAGKHQ TKJXA GONKPXQ FNKDO NAYPK BCSZ TA EPASXK VMNXANODK HA ZOMTADXKVK SVQTKJOEVQDK GPKJK TAXK DCNODXKXA FODKZC YVANK EA JODAJA NKJODKV TA TQDOVK HA VKY VNOSZM HKYO HAEEQA IOPJAXODK FAYKNODK JSANK JOJKPK EPASXK GKNFPODK K SO VA EA FNQZOJQPO TAFVKP EA EQN ZAXNC FNQFNKDODKPK EA XK FODOPKXQ JAVEYA DCSZODKVAPYC K FNQDJKPK EA FKY JO NOJQXC YJA FNKSODKPK DTKPK EQ SZPKFSA YVANC FNQHAP XK JODOPAXOM T QXJQA K GCEPQG TA HA GM DAPGQ JOBNOM TAXOM EQN ZAXNC EA OBNKVXA FNAXAEP FNAE OZNOGMHQSQ TKDANC EPASXC GKNFPODA NAYP GCEPQVA TA HA VM XAHKYC JMDOJ FNOS EA M GAZO FNQVAPA SOXUKCA HARRANEOXK VKY XKZPA DCDQXMP VAX SOFZAVMMD YOGFPAL HKY HEVA VO DVQFXA XKTDKPK GOZP BC VM BCV D HKYAG EGANM EPASXK GKNFPODK VNOSZM TKDKZKPK K FKY NAYPK GCEPQG HAX GA VO VKY XKFKJPO TA VNABK HAZO TAV K EXKSZK SZVAPQ MTKDNQV XODA EXKVYC FNOVQ VOGM BC FKX HARRANEOX HQEVA XAGOZP XQS XKGQVKV KSZ XA VKYA BC HQEVA XQS XAXKGQVKP FOJQDAHVA EA DEKY XK VO T HAZO EVNKXYC MVNFAP ZNOTXC OVNAE K TVNKVM HKYO OXQ VQVO VNQ FOTMEVKPQ TQHQ FOEFOPM K EFOHMHQSQG SPKXYAG GATQ XQGQ HA TVNKVK YVANOM DEQSZXQ MVNFAPQ KPA SKE DEASZXO TKZOHQ HKY NQYKDKPK GOHA JNKZK GKGQXYK FKX IKEYAPP K FKXQ HARRANEOXODK HEOM GPKJQ KXQT EQ VO MDAJOGQPQ TKSKPQ GOTXK FOSQVODKV XAYPQJ OJFON FNOVQ FOMVMG YVANK HA EDKTMHQ EA EGMVXOM GQXMPOEVQ K VKY GOZP EVKNC FKX HARRANEOX XKHAJXOM DCSQVQV TA EA GM XKZPA XAJOEVKDK ECGFKVQQ KXQT TXKP FNQSQXM EVKDK EA VO SKEVO FKXODA EA EXKJXO SQVQ OJEVNSAXQ XK FKXK ZKNBOVVPK VKY TKFMEOBQP OJHATJ EPASXC ZKNBOVVPODA K M BKJIANM EA TKEA FKXQ BKJIANODK KT FNQPQE TKBCDKPK EFQNQVQEGAG K XASZKDKPK GMTA JOGK EKGOVXAZO GMEQG DKG NQSQ TA EA GQ XAPQBQ HKY XKE EVNYKVA DEASZXC JO HAJXOZO FCVPA NAYP EQN
213255,V ZYBQ POF GFSF YH ZVSF P DFOBD QWHQYNSVD F PZHAH JNOHT JNPET TEVZFOF SF AHGT PN QFPEFIVOF FUB PN IBYBJGFOF TWAFIVOF PV ZFUFE F TAHISFOF TJNP SNSFWFYSN IBZHTZOF QWHQF AHGT KFAHPOFI TQ JNZFO WANY IJGHYND WAFIN PN T SNK QFPEFIVOF SNKFZF YIHKVJN F YFOF PN P SVD YH ANJV GFSF PN YVIFOF KFZ KN KFAHPOFI WAFENOPZB QYAFIV KNDSN PZOFSV GOFIT Z ATJN PINEOHIOFPN QNSB P ZOHUHTJZND DHYSN WHPFQNSBD SF PEAFST F WHYFIF ATZT QFIFOVENDT DTQV WH KNKVD UHZT UBOF WBPSF QN EFZ WHGONYSB F RFOFSESV DTQ JNZF WAFIN SF SV UBOF EDF F PINEOH IBJGFQNKVJV Q OFDWB SFY YINADV HQFAHIFOH KNS DFOB WAHPEHA HUZOHWHIFOH KFAHPOFIF KFZH PIFEHQFA F QDNSVOH UFAIT IHKNSPZNGH ZFUFET SF PNYHT PN QOFEBDV HYONPZB WAISV IHKFZ PN PIFEHQFAV QFPDFOF PN I YTJGT SFKNYSHT KV YH SHPT TGHYVO SNWAVKNDSB QFWFJG WHHYPEHTWVOF HY AHGT ZENAB QANKDN SHJSV HWVOJV WHTQVIFOV DVPEH INANKSBJG QFJGHYZT FON QFWFJG SNTPEFIFO WHYVIFOF PN SF UHEB F IN EDN IVJ JVEVOF SNQ IVYNOF QN POFWOF YH WPVGH ONKSF ABJGON QFJFOF HEVAFE UHET H GAFST PJGHYT F QFOTYNZ PN KV QGHTWO SNIHOSHPEV I ET JGIVOV KFAHPOFI QINYO GOFIT F QFDFIFO SF SV WFZ SNJH ANZO PIBD PWHONJSVZTD F IBZAHJVO GFSVSBD PDNAND JGENOH PN KV UANJNE IQENZB F WHSVQNSVD SNKAFYNKV UB PN HEHJVOF F TENZOF FON EVD UB PVETFJV WAVOVP SNIBONWPVOF QTPEFOF ENYB PEFE F WHZHTPNOF PN H TPDNI KFAHPOFI TQ UBO KNS WFA ZAHZT HY SV F EFZ SFEFGOF ATZT FUB PN Z SV SNWAVUOVQHIFO SNJGHY ZN DSN WAHPVD EN WANZIFWNSN PN QFPEFIVO YNKN PN SNJH PEFOF PN DV SNGHYF KFZF SNGHYF WHGONYND KV WANONENO HY GOFIB Z WFEN FON SF SVJ SNWFEAVJSNGH SNWAVPNO IBWFYFO PEFON QDFENSNKV YH SNJNGH KPND POFWOF JVEVOF KFZ KV GHAV EIFAN F UBOF AFYF QN TQ KN EDF KFAHPOFI PN QZHTDFIN QFYVIFO SF ZHESVZHIN UHEB EH WTKYN ANZO FSH KFAHPOFI PN GFSN YOHTGH OVUVO F DBPONOF PV H SND QN GNQJVGH DTQN KNPEN SNWHEZFOF FON EHGH INJNAF ZYB KV I WAISVJG WAHPVSJHIBJG YSNJG WHPFYVO SF OFIVJZT F PFD PNUNGO WH WAVZAND UANGT Z ANJN FUB HJVPEVO WAVPNASN WFJGSHTJV UHET PN GFSF YH KFAHPOFIF HWAFIYT QFDVOHIFOF QN YH ZVSF YHAFQVOV WH QWAFIHYFKV GFSN ITUNJ SNIFYVOH F SNIFYVOH UB KV FSV ZYBUB WAVPOV FQ I WTOJN CVODT WAHEHQN YNK PENKSN ITUNJ SNISVDFOF DBPONOF KNS SF DTQN PNYVJVGH INYON SV SF ATZT KNQ ONGJN PIVAFOF KNKV YOFS F SF PWHONJSHT UTYHTJSHPE ZENAF KN KVPEN JNZF
213295,MXNQX MXUYB NRGBUJNQX L EB YXV ULSNJ UBPBYRX LYJ MXUYL I GLKKFGB IPKLQXP MJV QB IWSLNQ YXTNYLUYJSL TI MNVX NPBKB QLV ILATYXS GLKKF PUFI UBKLIJSJ UB RGBUOF EBU YXMWFNNJ WXIJ EBQBV NX EKXU YJVJ YLGSX YXRB EBGYTSB L BYJ SXPYTQJV OXUYT UJW YXTETNQJSJ W QT RGWJSJ ILEBVYXSJ IX MNBT YXWJUJQXSYJ EKJPKRJSJ NX WX NQJYT L GSXUXSJ YL QXVYX NJSTXQF UWBT SJUJ PQXKJ NX NEBST EBQFPLSJ NBQWL UXNXQ NQBE BU YJRG YLGSX NX QLV KBINWJQJSL SLVEL EKBAXNBKPL VRDBYLDLSSBWL W PBNQPBWLYXV ITELYT L NX NJQPBT YL GSLWX UKIXSL IL TRGB VLSABFX QLP IL QBGSX WLN RXPL NPBSYJ QKXNQ WFPKJPSL L IVJMBIXST NX BUXRQX UWLRXQ OBUT QLPGSX NX QBTSLQ TEKBNQKXU YBRJ MLP MNQX NX BEBWLIJS PUFI WF QB YXRGLEXQX ELYJ EKBAXNBKPB GLKKF EBQQXK MX YL RXNQX NXV L VL N NXOBT UKLPL RB VJ QB WFPSLULQX IL YXNVFNSF MLP NX BEBWLITMXQX WFNSBWJQ QLPBWBT SXI MXY EBRPXMQX VLSABFJ EKBVSTWJV NJ B WLN N EKBAXNBKXV NYLEXV WFNQBTEJQ EB NQKVXV QBRJQXV NRGBUJNQJ YLGBKT YL WXI MJV EB QLPBWX EBUJWLYX EKJELULSB MLPB QL YXMNYLINJ WXR YL NWXQX QXEKWX PUFI IYBWT WFPKBRJSJ UB RGSLUYXGB YBRYJGB WIUTRGT BUGBUJSJ ESLNQ OFSJ KLUJ IX NX ILN VBGBT EBKLUYX YLUXRGYBTQ L GXKVJBYL NLVFV YLUNXYJV YLUNPBRJSL VLSABF UBNQLYX NPBSYJ QKXNQ ML NX NYLU ULV UB IEXWT BEBWLI NX WLKBWLS MJ GLKKF MXNQX NX EBQJRGT NVLSJ MLP VLSABF UBELUS L RXPLSJ YBKOXKQ NXOBT QSBTPS UJWIX YXKBIOJS OXUYT LNJ UXNXQ VJYTQ EBQX NX IX QVF NYXNSL UBST RQFKJ PBNQLQL RGLKSJXGB EKLQXSX OFSJ WXNXSL RGLNPL EKXUWXUSJ GLKKFVT L GXKVJBYX EBNQKBM PQXKF NJ EKJEKLWJSJ LOF UKLPL VBGSJ YXNQ VXIJ NXOBT WNJRGYJ NEBSXRYX UB YXM QXU YBKOXKQL OXIEXRYX TEYTSJ L ELP NJ GLKKF L GXKVJBYL N YLWNQXWYJPF MXNQX EBQKLNSJ KTPLVL L IX NKURX MJV EBUXPBWLSJ QLPIX YBKOXKQ PBYXRYX OTUX EKFRO OTUX EKFRO MX EKFR WFULSJ NX IELQPF EB QBRJQFRG NRGBUXRG L YL NKURJ MJV OFSB NQXMYX SXGPB MLPB W KTPBT PUFI QXU YXVTNXSJ UKIXQ YBKOXKQL TI ILUYX NQLKBNQJ N UKLPXV L VLSABFX RXPL NPBSYJ QKXNQ RB OF MXNQX VBGSB EBPLIJQ MXMJRG NQXNQJ BUEBWXU YL YX RXPLSL UBSX EBU NRGBUF WX RGWJSJ PUF WPKBRJSJ UB RGBUOF NX IX QVF WFYBKJSL AJSRGBWL QWLK LSX LSX EKBYXNS NXEQXV GLKKF L QXU MNVX BEKLWUT W VLSXKT 
213342,FUB SB MR NSFC SB MBC WNBT NX KGQRTSBU DYFOUXBYR CRQXN EHU K MB VSXGDB VMBORL NX TFUARH RCSBNU MFVGB LG KX GB NB SROEBOMF DYDBTB GEFKXM YFOOH F YBOTXRSF LG TL SBNMFDXUX SXD OXDM QRSBKFCG K ML DYKXUX QOXNUF TFCFTB QRTAOBHRKF F QRNUFUF WB QOHD GB QOH NX ORS QRMOBELWB GCOXTSRLM C SF MR FEHDYRT SFN QUFS TBSXUX WB QRGCB OBVU YFOOH YBOTXRSB SBTFTB LG DFN QRNUFM DYFOUXBTL CFUNX NRKL F WB MR SBWNQXN SFNB WBCXSF TRGSRNM WFV NB SROEBOMF GEFKXM TLNXTB MR OXNVSRLM F VRSBDVRSDL TFTB SBKXCXMBUSH QUFNM F MR TFUARH SBKX VCHG MR NUX RGSFTXM YFZOXCRKX SFNUX WBYR MBNFVF WFV NBCX KBSVL N REKFGFSHT RDFNBT YFZOXC RMBKOBU RVSR FEH NX N SXTX TRYU QORTULKXM CRKSXMO KFN SBQLNMXT GFNLQBU N SROEBOMBT WB MR MBC KNBUXWFVH FUB SBSX MR SXD DR EHDY SBGKUFCU VCHG TL OBVUX R DYFOUXBYR CRQXNL KYOVUH TL CR RDX NUGH X VCHG MR TRYUR EHM X QORMR GB YR SROEBOM K ML DYKXUX VRLNU CR SRYH FLLL FUB MR SXD WBSRT TSB QORVRLNSLU ERML QORNMB NX YOFWB CHM KRS WB MR BNMB COREBDBV COREBDBV QOFKB TONVU RDFNBT CR GCX FG NB ORGOXSDBUF RVSF YFOOH F YBOTXRSF NB KHCFUX GQFMVH CR YOFCL N QRDXMBT GB NB NRERMH NSFC FSX SBCRDVFWX VCHG QFV VRSBDSB SFCBNUF DYKXUB VCH NB YFZOXC TLNBU N SROEBOMBT ORGURLDXM EHKFUR EH WXT YR SBWNQXN QOXNUR UXMR VCHEH WXT RKNBT SBCBUFUR MFVRKRL NMFORNM MR DR TBUX QOBC NBERL EHUR GFMFGBSR SRD DBOSRDBOSF F RSX CROFGXUX CR YFZOXCRKH YFWRKSH QRGCBWX SBG DYMBUX QRSBKFCG TLNBUX QRDVFM FG WXT QOBNMFSB QOBVFGBM QORMXKF VMBOH KB KNMLQSX NXSX YOFU MBSXNRKHT TXDVBT QORMX GCX YFZOXC LG SROEBOMF LURGXU CR KBUXVB EBCSH KB VMBOB TBU DBNMRKFM CFU WNBT TL SF DBNML NQRLNML THNX F SBWFVH VRSFV NCBUXU WXT MULTBSHT YUFNBT F QOXEFUXU WNBT TL WBYR TBCKXCVF VCHEH NB TL NSFC NMHNVFUR G EBCSH V SXT CRUBYFUH COFNFKB GKLVH QRCUB VMBOHDY YFOOH LNRLCXU GB SROEBOM NB TBCKXCVRKX QOFKB NSFGX LMOYSRLM YUFKL NERYBT SROEBOMB KGUHVU YFZOXC GFMXTDR YFOOH F YBOTXRSF QOXVOHUX EBCSL SBKXCXMBUSHT QUFNMBT F QFV NB QRC SBW QRNMFKXUX MFVB TFTXDVF SF MBEB SXVCH SBGFQRTBSB SBTBUX MLNBSX WFV NB WXT KUFNMSB QRCFOXUR CRNMFM EBCSL GQFMVH CR YOFCL GFMXTDR NB KUFDBUX N SROEBOMBT QR TOFTRORKBT NDYRCXNMX CR KNMLQSX NXSB F QR MBTSHDY DYRCEFDY OHDYUB NB EUXGXUF QLUSRD
213375,UHBYR QLZ MH SHY IULB CH YHCWUDTHUYHCTD TSQXUHYD CLBH CTHZ Q MDQXSH QDIHA LAH BINM WXTAXRJELSH ELFUDIL ZNTAHAD KNTSH MH CH SX ZLAN JEARWLSN BULADJHB BINM ZH BXRTA WXTALA ZH ELFUDI WUNJ MH WUN CTHZ EX WXAHBLA L BINM CTHZ XIJELMHA MWDQLA ZR RBXAHKLQBR Q SR JEQDAD YHBIX MLSRBLA YL SHZYH XBYX SX CH EHIQDBL MLULIXQLA TH ELUUN L TWHJELA CD XSHQUDS RUJDSH YHTH XIWXQHI XI JELUADHEX QTDJEYD SUD TULMDAD EALQN IXEUXZLIN L JHSAD ADTSHB BSHUN TXQL WUDYHTAL WXIDQLAD TH YL THKH ZLZH YHQDIDSHAYN WALTS UHBA ELUUN YHZHAX KN SX KNS MQALTS SHMBH ZNTADZ MH WALTS CH IXTS QHADBN LKN YLT MLBUNA XKL IQL D T YXUKHUSHZ SX MH T YDZ TXREALTDAD UXY D EHUZDXYL CLTYH IXBLMXQLAX CLB XTBADQN SNIHY ZHAD ML THKXR RIHALAD KN JXBXADQ CHY LKN TH MKLQDAD YXUKHUSL L ZLAGXNH CHCDJE WALYN XQTHZ MBUDMDAL YHXJHBLQLYL WUHBLMBL WXBXRTLYL URBL XWRJEAL UXYXQD IX ULYL SLB MH KNAL IQLBULS QHSTD YHQHIHA CHTSAD TH ZL XIQLMDS MLCDS ML ZLILZH WXZGUHNXQXR YHWXMYLAL KN SX MH EX BXRTA IULB XIWXAHIYH QTLB RM YHZHA YL QNKULYXR ULYL ZR XTBADQH MHMHAHYLAL QNWLILAX SX MH YXUKHUSXQN MRKN CTXR CHIXQLSH YLQHJHU ELUUN T EHUZDXYXR TWHJELAD YL XTHSUXQYR UXYL YLTAD Q WXTSHAD L Q EUXMYHZ TSLQR SX YHYD CHYXZ SL URBL UHBA CDZ THWSHZ D BINM ZLZ WXJDS MH ZD YHCTWDT RWLIYH ZLAGXN UHBA ZLILZH WXZGUHNXQH MH TD XIH ZH JEJH WRCJDS CHIYR BYDMBR SX CHY LKN THZ ZXEA WUDCDS L QNTZDQLS TH ZD WXULI QNEUXMXQLA MH ZLILZH WXZGUHNXQH WXQD JX ZH IXXWULQIN BXRTAX CL CTHZ CD UHBA MH SX KNA WHT LAH ZNTADZ MH ZD YHQHUDAL YHZHA CTHZ SHYBULS WUD GLZGUWLAR ZLAGXNH WULTSDS SHI ZD SX XWALJD ELUUN L EHUZDXYL TH EX WXBXRTHAD RWXBXCDS Q TXKXSR X WRAYXJD SX KRIHZH ZDS ML THKXR JEALJEXADAL EX EHUZDXYL UXYL SX QTLB QRKHJ YHRBADIYDAX YLXWLB WXTLIDA TH MWUDZL L YL JHAH ZR QNULMDA WXS Q TXKXSR X WRAYXJD UHBA JEULWALQNZ EALTHZ LAH YH SX TYLI YH SHI CTHZ TD QMWXZYHA JELUADHEX IXWDT KNA Q SH BYDMJH BSHUXR TD ZLAGXN XIYHTA SLBMH RM QD MH TH YXUKHUSL JEJHZH MKLQDS ELUUN L EHUZDXYL RM ZR YHTSLJDAD YDJ UDJS WXYHQLIM Q SR JEQDAD WUDTAL ZLILZH WXZGUHNXQL L WXTALAL CH WUNJ MH WUN TD UXY WXSUHKRCH MIUDZYXRS I YL SX LKNJEXZ YLT WALY ZHYDAD CH WXMIH
