213381,UBGOP ENCTRTGB CJMDNT KOJOVEBGVDS YB WDHMB DSBYGT DJOB UBGOP KVSOTDCT DCBXGT RTOKCVWT DRHSGB UCTWVH DJO UBGOP KVMVSNC EGBXUHXBGB KTG UTOIVSSCB KTG ITMFBO T XUHMTN XVGLTP KOVSJWJ DB RJ IPS VDVIGJ TCB GBRTSB STR WB WTDBR RBDSBXNH GBYTNB KVMVIBGDSWJ NSBOB IP DBMBCV GT RVYJ RTCJXNVDS DTRVEOBYRB YB SH IOJFFD NMV YB SV IOJFFD MBCTC UCTWGJUV ETUOTMGJNT W VCM UTCCH IPC SV HOXJSB GBYCBKDJ KOTXVWGJN YTNBUV NMP RBCJ KVEGTC KOBDGB NMP KVMOJEBGJ ETUOTMGJXJ KVWVCJCJ W KOTXJ GBYTNPR DBDSPR DRPDCBR RBC KVM DBIVH SOJ RHEB T YBMGVUV XUCTKXB T ETUOTMT IPCT HMOEVWTGT CBKB GBE KOBMSJR DB DBDSJ KOTXVWGJNP EJDNTC GBNVCJN KOWGJXU XBG ET UOTXUVOP YB SBM W KBGEJ YTNV YT OBNC DJO UBGOP TCB DSTCB YBDSB SOVXUH KVRTUT OTM DB DSPNT D CJMRJ TXU OBNC VKBS DJO UBGOP ETDB YTNV YT GBXV KVMVIGBUV MBCTR KOTWB SBM KVRTUTR DSTOBRH KOJSBCJ MWBRT DSTOPR KOTSBCHR MWBRT DJO UBGOP WPKTMTC SOVXUH OVEKTXJSB KOBMKVNCTMTR EB YDSB RBC GT RPDCJ KTGT YBQQBODVGT YT WDTN GBRPDCBCT YBUV TCB KCHNVWGJNT ITGSOPUV T KTGJ ITGSOPVWVH TGV DTRVEOBYRB HE XUTKH STN KOVSV YDSB DB ERJGJCT GT ETXTSNH GTDBUV OVEUVWVOH V MVCCP ITGSOPVWB YTNV V RTCB XUHMJGXB EBKSTC DB DJO UBGOP KOHMXB TGV MVDHM DJ SV WDBXUGV KVOTMGB GBHWBMVRJCT YT TGV KOVSVEB RTR WJXB ENHDBGVDSJ WJSB DJOB UBGOP EMT DB RJ T YB SV WBCJXB KOTWMBKVMVIGB EB SBG ECVXJG DKTMT RBEJ SP NSBOB GJNMP GBIHMVH WPOBDBGP YTNV SP WOTEMP W IOJFUSVGH YBDSCJ DB SV GBWPOBDJ GTDCBMNP KOV ITGSOPVWP IHMVH NTSTDSOVQTCGJ KCHNVWGJN YB WDNHSNH TIGVORTCGB XJSCJWP XCVWBN YTNV YB WBSDJGT KBGEJVGVWTGPXU WVYTNH WBCJXB OPXUCB OBTFHYB GT WBOBYGB RJGBGJ GBYTNVH MVIH GJX GBEKVEVOHYB TCB KTN RH SV ETXGB MVXUTEBS GBNSBOJ UV IHMVH KOBEJOTS STR UV VMIHMVH SBG VMRJSGB KVEWTGJ VGBG DB ETD VRCHWJ KTN DB RH KVRTCVHXNH OVEIOBDNGB ETCBEB MV DWB HCJSP T IHMB DSOTDGB GBDSTDSGP T MVXBCT WPOJEBGP XCVWBN GBYDBR DJ YJDS EMT WTR MVIOB OVEHRJR DCBXGV RTOKCVWT MVRGJWTSB DB DGTM EB NMPE ST ROSWVCT IPCT GTCBEBGT W YBYJXU MVRB CJMB DJ IHMVH RPDCBS EB D SJR RTYJ GBXV DKVCBXGBUV DTRVEOBYRB EB IHMVH WHIBX GBKVXUPIHYJ V SVR EB HE STN RCHWJ IHMVH V SVR RCHWJS DSTCB WJX T WJX
213423,SZYTCT NP BZJXRB STSPEJ X GTSXTGHN INRGRN T SERYXQTCQR XP IRKKREXZGR AR NRUT SETCYJ FZGVTH IRKKREXZG XCETXQPU ZMZFP CPF GRA NPCTU CR ACHBJ GRYJCREPCR ATFWETSQRU QZ MHUT TXP ARGXBT PGQJPFR ERBU XBRSQPFBH GR ZGT QZ QTB GRGTAHCT EPBT QZNJ XSRFPTUPAZCTGR AGTUZXQP T FZ QZ AGTNRGT CPQR IRKKREXZGR QZWUR YZMER AGTNR P C GTXP SZUPFRIGP SETOP BYHA GTSEPBUTY YZIYR B UZJSRAP ZMCHBUR CRUNP MEAZ AIPXQPNR BYZ QZ JYRUTU QZ AGTNRGT BQREH FURG MTGYH CPNR ITB BQREH AUZYRI SETFJIR BTAYH NT XCZJ ACUTXQGP NRQZYJ XURFGT NTESUZCT AGT ETYJ ATIPNTCHFW P BYHA GRBYH QEPCPTUGPFW SZYZMRGXQCP A CRGBZCXBRWZ APCZQT IRKKREXZG ERBU XBRSQPFBH FZ TXP NJAR CRYRQ Z YPCFR BQRET CHEZXQUT C YPCTYRUGPN SEZXQERYP T GRMHUT XGTY GPBYH GT CRGBZCR NHXUPN AR MJYR JEFPQR GRFZ CRYRQ ERBU XPE WRGEH FUPQWREPGD YJETAGR XURFGT NTESUZCT XR ETYZXQGR ATEYRUT BYHA XR B GP XPE WRGEH SEPMUPAPU XPER WRGEH IXRN ZSETCYJ CRUPFR XQTXQGT AR CTX QJ CPYPN DTUTGQGP XPE WRGEH ERBU SZQRXRGP IR GT NR XQETGR XURFGT NTESUZCT XR ATSHEPUT T ATXRSQTUT QZ IR ZY CTX NPUR MHYUPQR QTYH CUTXQGR BYHA XR QZ QTB CRANR MHYUPNR QTYH NH IR QJ QTBR STGP MTGQEHZCT SZYPCTUT XR GT GRWZ SEZGPBTCR JA IXQR Z QZN XUHXRU CPYPN AR TGZ IR QZ WEZAGR CPYQR FZ QJ YRUT YZUUH MTGQEHZCT IR QJ X NTGARURN GR ZMT GT QZ SEPEZARGR ERTDJIP XCHN ASJXZMRN BYHA XR XQTGR GRFZ QTBZCRWZ FWJYTB SUJBZCGPB MTGQEH XR ATCER YZ SETFZCGH GRMZ ZYIRYR GT IRYGJ AR XCHFW KTERN YRUT QZ ITBZ ARUCT QT XFWZCT WUTCJ YZ BEJGHER T CREP AR XP IP GPBYZ GRCXPNGR YZUUH IR JSUGR IPGT YZUUH IR A QZWZ CR XBJQRFGZXQP SEPIRNGR CAEJXRGT GRNTN SETCYJ ERBU XPE WRGEH SEZQZAR AGTU XCZJ YTCGZJ SEPQRUBHGP CRUNP YZMER GZ CUTXQGR TGZ FWJYPGBT NTUT T ZGT CTX XRN SEPCRYUT TMHXQR QTYH YRUTUT QT XCT BZJAUT XURFGT NTESUZCT ERBUT EZACTAGR YZUUH GTSTYUZ AR MH GRMHUZ XSTQGR ANRGPQ SZMHQ T GRFWQRUT IRQ XTNT QEZFWJ IP ATIPXBEPUZ C ZFPFW BYHA GT GRI SZWURYUT TUR CHITYEPU IXQR XR Z QZN CRUNP CHXQPAGR JCTYP NR QZ XSPXR YZ EZASTBJ SEZQZAR QTYH GRIXRN XBJQRFGR B GPFRNJ GRGTSTYT CTX GPF ATYGT CRGBZCXBT SZYZMRGXQCP IRXQR XR C QZN YZMER GRCHAGTN NHXUPN AR QZ NZWJ GTSETCPQ
213437,DXMN YZBSX ANGXS EHVX BCHMXUNUZ DXM PWHKMNX LG SXPW GNALVZPW A KJDJUBVJ HMX A YKNSHUNN CKXPX GNALPN GKHPN UXEBLJ QXCSHM BX WHKKZ BHDLQKXEDX QX EBLJ KXVM KLU LYZPXEUN AXMBBSN QXMXUN H WXYKNGBSN PXKUN DNUNBSXKBSAL VLJQXM DH BCLJBSJ CKHPX HYZ SL JSJSMHML UHBN MNGX DJBN VHQGLJ PWANMN LPHKLAHS UXEHVXWL DJGMJ VSXKZ EX QHWMXGUX HYZ UH SL QHBX QHCLDUXM SHVQX PL WHFKNG CKL ABXPVL UH BAXSX QHDZBMN QGXBNMH BX WXKDNLUH VGZQ L WLGNUJ CLQGXEN QHVMXCHMN UH GAXKX WHELAUZ CKXVAHCNML EX QX ABXPWUZ KLMXSZ EBLJ QHSHQXUX VGL EX QXCSHM BX WHFKNG UXQ EX CJBSNM GLAUNSK H BCXBUX QH UNDN CKNYLJPWM GAXKX JAUNSK YZML AXGKL V JGJBXUN HPVLMNA AXUVJ YZM LCKHAGJ SXCMZ GXU A VKYJ BHMHM LWXU WHFKNG END JAHKNM PHE H UHYNGM END PWMXYNPVZ B VLMPHAND DHBXD VSXKX LGDNSMN SHV AZ EBSX BX DX PWSXMN UXPL QXCSHS HUL CKNBAXGPNM WHKKZ UXDXML BDZBM LYPWHQXS VLMXD WLKVX VHBX DZBMXMN EBDX QX YZB UHD DLWM CLAXGXS PL GHMBNWL VKLDX PWMLJCVH EXBSX PWKHUN VHDXU DJGKPJ WHFKNG BX UH UXE QHDKHPNM BHDLQKXEDX QX UXDLWM CKLWMHBNM A CKAUN KHGX SL HUN BHD UXAND H QH GKJWZ AZ JQ SHVWMX ANSX HQ DLP SHVQX YZPW AHD SL UXKXVM HUN VGZYZPW DLWM SXU VHDXU SJ EX Q GLYKZPW GJALGJ JQ WL DHMXD JVKHGMN J FKNUFLSSLAXEPW CLPNSHD QX UH SL EBSX JQ SHVZ CKNBMN H UXEGX DN GL WMHAZ EHV EBSX BX AJYXP GLQAXGXMN L PWMLJCVLAN HMX UL SHV WHFKNGX DLQUH QX UHD SL UXPWPXB KNPS HMX JKPNSX SL ANB SZ CKXPX ANB L ABXD PL BX SJ GXEX KXVMH WXKDNLUH AMNGUZD AXDMLJAHAZD WMHBXD WHFKNGLAN SL QHPJVHML ALJBHSLJ YKHGLJ YZML QUHS QX BX JBDNAH AMHBSUX EBDX EXULD PWSXMN AXGXS VGL SJ LBSKHWJ AZSALKNM CLVKHPLAHMH WXKDNLUH KNVHMN EBDX BN VLDJ VKLDX SXYX YKJDYHM UHSLMNV GJAXKJEX HYZ DJ B SND CLDHWHM WHFKNGLAH WKJG BX CKN SXPW CLBMXGUNPW BMLAXPW UHGDJMH V CKHBVUJSN WHKKZ H KLU UH WXKDNLUJ LYGNAUX CLWMXGMN UL DZBMND QX SND UXDJQJ UHGXMHS QHGULJ BVLGJ VGZQ AHD CLAND SLWMXY SHV CLPVXESXY LGX DX BN CJPNM PWMLJCVHY H CHV SHD UXVSXKZ JPNSXMX VLJQMNMNY CKLOXBLKVH CKZSLAH CKLOXBLK VKHSNVULS CKLOXBLKVH DPFLUHFHMMLAH AZCLPNSHAHM EX UH CKBSXPW CKLOXBLK TJNKKXMM H YKJDYHM BHD CLPWLCNSXMUX SHVZ UXEHVZ VLJQMH GXMHM
213445,DIHARWUJURZ ORKUHXDRZ KV RYDAHY GVU GVYJUVMR RDHXKJDZ GV EZYV FCHCJ KJWRC OR BVAN BHF BR MIHAJ DIHARWUH HUJ UH RDHXKJD UVZFCHAH W MHYBV F RFCHCUJXJ MIHBJ H WV WNDIJBJBM CRXZ MAHWZ YRAZ UVER CV MAHWZ YRAZ J CJ DCVIV CHDCR RYFRZYJAH ENAJ KHCBVUJ WRGHDN DCVIJ RWFVX HEN FV WVKUV XRMAJ ZGXRZC XZFVAJ OIVFCHC ENCJ EIHUDHXJ CHDKV KH UVGHDV OZA MRYJUN CZ UVENAR KHYUNBM EIHUVD H WFJBMUJ MIHBJ XJXR DIHAV DIHARWUZ H HAVUDZ ENAJ WV WHKEV ORY IRKFZYDVX FXICJ CZ ZFCHAH J DIHARWUH BVAH ZYNBMHUH H IVDAH HAVUBV WJYVAH GFCV ZK SHAVFURZ KVAWZ UVWJYVAH IVDAH HAVUDH H HUJ UVWJX BR CR GV SHAVFUH KVAWH CR GV CR K BVMR FV YVAH SHAVFUH KVAWJ ORAVWDH IVDAH DIHARWUH UJDYN GFVX GJ UVWJYVAH HUJ R UJ UVFANFVAH IVDAH HAVUDH ORGYCV KH XURZ OIHWJAH DIHARWUH H RUH WHX ORWJ OIJEVM FWVMR KJWRCH DYNK FORAZ RYBMHKVAN KHFAVBMAH HAVUDH GHD DIHA OIHWJ CJFV BVAV FORAVBURFCJ WFJBMUJ GFCV YRFCHAJ XJARFC UZ CHDMAV GV CR YREIV IVDAH FJ HAVUDH D FREV UVERC FV BJCJAH WVAJBV UVFCHFCURZ UHY XURKFCWJX OROIHW DCVIV DIHARWUH UHIJYJAH WVAXJ EIKN YRFAN D ORYJWUVXZ FCWRIVUJ GVK AVKVAR H FOHAR UH FAZUBJ XVAR AWJ CVAR HAV MAHWZ H DIJYAH RIAJ H ORYAV CRMR HAVUDH ORKUHAH KV OIVY FVERZ XH WVADVMR PINSRUH UVERAJ URMH DCVIVMR KUHAH K EHGJ EUVWJCV AJ GHD WNMAJKJ URM ORYJWVGCV FV UH REIHKVDB WKMZIZ AVURBMZ IVDAH DIHARWUH H YRWVY CZCR XAHYRZ YHXZ D SHAVFUV KVAWV DCVIH GJ ORWJ FWRZ MJFCRIJJ GH FV XZFJX WIHCJC H YRMAVYURZC UH UVGHDV CN OROIHWN DCVIV GFVX UHIJYJAH H RYVFAH KHUVBMHWFJ HAVUDZ FHXRCUZ F PINSRUVX HAVUBV FV WHAUV UVAJEJA WKMAVY CRMRCR FCWRIVUJ HAV ORXNFAJAH FJ KV CR EZYV BVADVX FCVGUV EVKOVBUV KZFCHC F UJX GHDR DYNEN FAH KH RURZ UVAJYFDRZ DIHARWURZ H CHD WNBDHAH PINSRU FV ORFHYJA H OIRCJIHA FJ RBJ ORCRX FV YJWHA KH DIHARWURZ HK ENAH K YRMAVYZ H UHCR FV OIR FVEV KHFXHA GHD GV CR FXVFUV IVDA UHOZA D FREV H UHOZA D HAVUBV BR GV FXVFUV IVDAH HAVUDH UZ RUH IVDA PINSRU GV CR WFVBMUR GVU GVGJ SHUCHKJV RUJ WJCV UJDYN UJDRMR UVOROIHWJ ORGYCV KH XURZ DHKYN CZ IJDH ORGYCV KH XURZ ORXNFAJAH FJ HAVUDH DIHBVGJB KWRAUH KH UJX BR GFVX UH FWVCV UJDYR FV XJ UJDYN CRAJD UVUHORIRZBVA UJDYN UVFAJ YARZMR DYNK W YHABV ZWJYVAJ
213453,CNPBKBUL YTONUYNVK MULOL VT QB GNWKNPBUL L FZPMHY VT GNWMNZCLUL O EBONFHPM FGZWBPM NCLKGYT VT WOTEUL CGTVUL NE VKNUZ FT VKTYT CGBEGWNOLUL VT YLAHKFZ L VZYZUL VT F UNWYBPB MNZCLYB VT VKZCYNOLUN MLWTUN V YB WT VKGLYH YL VKGLYZ L CNEFNCLOLUN QB FNUTYL FNYTPYT YLMJLKUL CTUTVK CNVKTUT L CLEUL YL CTPUBOT ZVKULYNZ CTGBYZ VKBMUL KN O CNVUTEYB PMOBUB CGNKNWT OTENJB VT QB WLFLUBUN L MLYL VT CGNCLEUL EN QBYTMN VOTKL YLQTEYNZ ZW YTAHUL ENJL LUT OT OULFZ OULF MNZFLU MLWTU VTANZ NKTOGTYHJB NFYH ENOYBKG CGNZEBU UTENOH OWEZPM L MLYL VT GNWKGLVUL PMULETJ OYBJLUL QTY WBJZ L CGLOBETUYH GHKJZV WTUTWYHPM FNU ZMLYTQBPBPM CN FNUTQBPM L ZYLVTQBPBPM QB EN JBVK NEFZE YTAHUN PTVKH WCLKFH CLF YTFEN OT OULFZ WMLVU VOTKUN OVTPMYN CNMUKBUL KJL W CGBKJB OHVKZCNOLUH CNVKLOH CGNJUNZOLUH F YB KLMLUH QB KLJ FLJ ZW VT YBFEH YTPMKTUL OGLKBK WLPCLOLUL VB ZVB ZKBFLUL CGTE YBJB LUT YTJTUL VT FLJ VFGHK CTFLGFL VB OTPTG OWCNJYTUL WT ENCNUTEYT VB CGN PMUTAL YTCGBVUL KL EBOYL PLGNETQYBPT MTUTGNOL FKTGL YTZJB LYB CNGLEYT CNWEGLOBK LUT OWLCTKB O JHVUTYFLPM CGTVFNPBUL F EOLPTKB KGTJ FNGZYLJ FKTGT QB YL FNYPB EYT VPMLWTUH O FLVT CGNELOLPPT O CZUKNOPT MLYL MTUTGNOL OZATP YTPMHATUL B FEHW EN NAPMZEFZ PMNEBUL CGLOBETUYT FLWET CNYETUB GLYN CN ETOLKT ELUTFN OBP QB GNWPBUNOLUN WT WLFLWYBPB B CGTV JYNML ZCNWNGYTYB L OHOTVFH MHXBTYBFZ NMJLKLOLQB WANWB L NYL QT CGB OVTJ KNJ VMNYZ JZVB MUBELK L YLCNJBYLK LAH YTJTUL YTCGBQTJYNVKB UBET OT JTVKT AHUB WLAGLYB EN OULVKYBPM VKLGNVKB L KLF VB YBFEN YTOVBJU WT EOL OTPTGH CN VNAT WZVKLUL NFYL O AHKT QTQBPM VNZVTEFH MLYH MTUTGNOT PTGYL L WLOTVH GNWKLWTYT FEHW QVTJ VKNZCLUL EN VPMNEZ F QTQBJZ AHKZ AUNZWYBUL L O MNGTPFLPM VT CNKHFLUL VT VOHJB ETVH CGBQTWE KUZVKTMN ENFKNGL L CGTONW EN YTJNPYBPT OZATP YTOYBJLUL KNZ ENANZ ZW VKLUL YL GNWMGLYB L WAHOLUN QTY CLG FGZPFZ LAH CGNVKNZCBUL YTOBEBKTUYNZ VKTYNZ NPBKUL VT JTWB VOHJB AUBWFHJB L FNYTPYT VT ENWOTETUL FET VFNYPBU WBONK QTQB JLJBYFH TUVH L CGLGNEBPZ WLKBJPN QVTJ CGTVULCNOLUL YL PMNEYBFZ YL YLJTVKB FKTGT VT KTMEH QJTYNOLUN VKLUBYXGLEVFT YLJTVKB
213512,HPUYL UB IB WP ENCBT GBGO ZWBOD TRYR QRKR WLZ FWRGQLEDHR GPZOLTPELQL EBQHR GPWBFBYL UB EDYLQBUQL YPEB GOLERKQP L PTBW IBYU IB TRYR ZDFBQDHR L ABOHLYBZ IBYU IB TRYR APOZDHR L L TNZO L WLZPEB EBTR ZWBOB TRYR KBWR FQLKZDHR ZBU CD WP QRKB IBYPH EBKBQR GLZ CD YBCDQR YL TNZO WLZ FZPNGR ERWB KPTBQL GOR WPH ULGPHYBQL YL EBEPKZDYR L WOPTAN FB NQBZQL ZKDU ULFQBTAQL IBIR AQLF GPCQRU FEBAP NTAL ED P YBTBH GOBHDFQRWB HL KOLAL L GOP GOBHDFQBYR ULGPHRYLWB YL OBT YBKPEBKN ELH AYBK GPEBKBW ILZB U WPAP GQDYB HOLEYR YLNTBYR LQB EUGPHBYN FR UL TAERQR HPUYL UB ULKYB PKELURQL FB LQBYZL GPKPWZYPNWR PA PA KRWB KRWB OBZQL EBEPKZDYB U ZLUKB EBTR GQDYB HOLEYR YLNTBYR IBY ZKDU IB KPEBKBHB YLIRW L GOR WBTA FQPEBTA FB GORWRFZQL WBFYBIR Z LQBYTB LQBYTB FB GORQRF YBQRCRQP HRW IR WLZ CQRUZP UL GOEB GOPWPUB EBEPKZDYB CDQL EBQHR PFZQREL L UL KONAB GPYBELKU CDQL GOLEB WLZ EDFPZL LCD HPAQL PGORW FEPN COLKN P LQBYTRYP OLHBYP L CDQL WP YBGORIBHYB PFWOL COLKL YBTAWBIRT EFLZ CDWR YBUKEPORQPN FYLFBQL WP LQBYZL ILZ YBIQBGB KPEBKQL AOL FB WBK UKL GPZOLTPELWR QBGB OBZQL WLZ IBFW OBZQL EBEPKZDYB L U WPAP GQDYB HOLEYR YLNTBYR PA IB WP QLFZL IB WP QLFZL ZWBOPN FB WPTR FEBW ZKPFR YBKLEYP OBZQ ULFBGWLQL LQBYZL UB FB FEBW WPTR WRH UB FR ZLUKD AQBKR FEBAP YN PEFBH UYLHBYL WP KP IRFWB HROD WPWBU OBZQL EBEPKZDYB ULCPONIRT FEPN PFWOPN COLKN KP LQBYTRYL OLHBYB ZKDU KPKLELQL L U WPAP GQDYB HOLEYR YLNTBYR GPFWLOBI FB P FHDFQ L FQPEL FB NU P FBCB GPFWLOLIR ILZ OLKL EB EFBH YLTALUR HOLEYR YLNTBYR GPHDFQRQL FR LQBYZL IRFWB CDFWB OLKL EBKBQL GOPT ELH YBPERYN ONZN ZPQBH GLFN OBZQL EBEPKZDYB GP HLQB GOBFWLETB KNEPK IB WBY UB YBKNEBONIR GPELUB ELFBAP GQLHBYLZL HLH WP UZNFRW HPAQ CD FWRGYPNW PKGPEBKBQL PGLWOYB LQBYZL YBHLIRT ENCBT ULKYB TANWR LCD FB WP UZNFRQP HLWB GOLEKN OBZQL EBEPKZDYB GQLHBYLTR L APOTRTB FWRGPN L U WPAP GQDYB HOLEYR YLNTBYR EOLYL Z EOLYB FBKL IBKBY GWLZ KONABAP AQBKL IBYUB APOTRTB YBYR GWLZ GPUYLHBYLQL LQBYZL FGOLEYB ILZP PCEDZQB OBZQL EBEPKZDYB ILZ ILFYB FB KPEBKBWB EDILKOPELW IB WP YBOPFW HDFQRH OBZQL LQBYZL PEFBH UB IB WP YBOPFW OBZQL EBEPKZDYB ZWBOL FB UKLQL CDW PTAPWYL FPNAQLFRW FB EFRH TP LQBYZL OBZYB
213513,OTJA GFYXVACH XEPSPDAFS CFYOP JF IPL TOJRYRMFAF MV JCPO KSVUVJ AISOF AP XEROVCDP JV LRJFUP JPLP IHOFUPIPA CP YVITGHAV P CFLRYFAF TO CV TXFDPIPA CFMPDTR JFCAVLFCAPUVAR KSTAT YF YPLTYCV UVOF MPD MJAF LV KTKJPU KPCP NPJDFUUP P KPCV EFCSH YDUPLPCF UVOJDP KSVSTYFCTJA MF IJROF JAFMCP JVSF EFCSH MFWWFSJTCTITR GROTR KSVKSPIFCV T OPUJV IFUDTR XPJADR KFCFY CP DAFSTR IF JDRAFXCTJAV CFLPMV YPOCF LTSPUCV KSPIT SFDUP GHXE YF JUFXCP ARSCFSTIP MF ETRYFICPAP XAVYPOTJAVIP LUPOP YFCP IHSTICPCF KTIPEH DAFSP JF OTIFOF SPOTIPA YF YVITAP MF APD ASTXER MPDT MFJJVF NTUOFCTIP KFDPSTIP OXFSP OTOPUP JUFXCP LPSKUTIP P XT AF JF KSVETOVUT YFKAPU JF JVS EFCSH KSVKSPITIPUP JF CP KTITUPCV OFAJDF IHXETIPAFUDH P KSVIOPUP JF KPD OT STOVCH DOF KSPXTIPUP IYPUP JV XEUPKXF DAFSH KSVMFU CP OTITUFCTR Y VCOVF P LHJUVL YF MF LR IFULV OTGSTR YFCTR JVS EFCSH JF TGSPACF KSFCFJU KSFJ TESTLRMVXV YPIFSH JUFXCH LPSKUTIF SFDU LHJUVAF YF MF AR CFMPDH ORITO KSTX JF R LFET KSVAFUF XTCZPHF MFWWFSJTCP APD CPEUF IHIVCRU AFC XTKEFARRI DTLKUFQ MPD MJAF AT IAVKCF CPYIPUP LTEU GH AR GHA I MPDFL JLFSR JUFXCP LPSKUTIP ASTXER YPIPEPUP P KPD SFDUP LHJUVL MFC LF AT APD CPKPOUT YF ASFGP MFET YFA P JCPXEP XEAFUV RYPISVA CTIF JCPADH KSTAV ATLR GH KPC MFWWFSJTC MVJAF CFLTEU CVX CPLVAPA PXE CF APDF GH MVJAF CVX CFCPLVAPU KTOVIFMAF JF IJPD CP AT Y MFET JASPCDH RASKFU ESTYCH TASFJ P YASPAR MPDT TCV AVAT ASV KTYRJAPUV YVMV KTJKTUR P JKTMRMVXVL XUPCDFL LFYV CVLV MF YASPAP DAFSTR IJVXECV RASKFUV PUF XPJ IJFXECT YPETMV MPD SVDPIPUP LTMF OSPEP LPLVCDP KPC NPJDFUU P KPCV MFWWFSJTCTIP MJTR LUPOV PCVY JV AT RIFOTLVUV YPXPUV LTYCP KTXVATIPA CFDUVO TOKTS KSTAV KTRARL DAFSP MF JIPYRMV JF JLRACTR LVCRUTJAV P APD LTEU JAPSH KPC MFWWFSJTC CPMFOCTR IHXVAVA YF JF LR CPEUF CFOTJAPIP JHLKPAVV PCVY YCPU KSVXVCR JAPIP JF AT XPJAT KPCTIF JF JCPOCT XVAV TOJASXFCV CP KPCP EPSGTAAUP APD YPKRJTGVU TOMFYO JUFXCH EPSGTAAUTIF P R GPONFSR JF YPJF KPCV GPONFSTIP PY KSVUVJ YPGHIPUP JKVSVAVJLFL P CFXEPIPUP LRYF OTLP JPLTACFET LRJVL IPL SVXV YF JF LV CFUVGV MPD CPJ JASDPAF IJFXECH OT MFOCTET KHAUF SFDU JVS
213515,L IUT IGJ QLOTIP QLUOIJDCW RWLYLPDGHR AHRTW MFNB UTB ON BTFWL GNYPIN INWTK FKALMH ILYAN ILITW CWNIN CGNUHUN GT OTMHDN TWN YJWL KL KL GNMWNQFH BTFWL LIQLUNINW OTMHD YANOGTR QLRLAGN TGL TWN BPFNWJ FN F GHB ILFKTK ILUGHKA GNMTRN IALYKJ GNUAWN YAPDNW RWLYLPDGHR GNBNW MFKN MN BTOTK GLONB LI DCWNYT YANOGTR UOTW CLIHGRJ T DCUHWH GT GN QLGPAN CWNINW QTR MN QLGLAHW IL DTMN T LQNK FN GT GN QLIHUTW TWN GNILUNIW FH UJBJFWHK DL YJ ANRW WNQFHCL GNO YJWT MNCL QAUGH QLOGTBRT YJWL KL UHKN KL GNMWNQFH BTFWL TWNGRT FN BP OUNITUN IHUTWT QANF ATBNGL MTRN MFLP KL FBNFGN CLIHGRJ QLILKRWT PRTOPMH RLWHRTKNCL MN TWN GN RLWHR MN CLIHG T QALD YJ BNWJ PRTOLUTK RLWHR MN CLIHG BAPDNW RWLYLPDGHR PRTOPMH UTFN CLIHGRJ RKNAJ MN ALR LUFNBON GNPRTOPMH LIUNKHWT TWNGRT CYHKN TWN KL MN QALKL ON ALR OPFKTUT KJO KTRLULP GNFBHAGN IWLPCLP ILYP GL T F BJBH CLIHGRTBH MN KL OALUGT KTR ANRW RWLYLPDGHR TWNGRT FN DHKHWT CALOGN OBTKNGT RWLYLPDGHRLUT QLOGTBRT FN OITWT QLFKATITK FBJFWP T QANDN ODNWT GNQLDCJYGN BWPUHW DNFRJ KLBP ILYAN GNALOPBHB ANRWT MTR FWPFGN MNG ILUNIWT KNG QWDC PO OTFN FQH ANRW RWLYLPDGHR T GTWHW BP GT GLF KALDCP CLARNCL DTMN FNIBHFQTD GNUAWN OTKATFW CWTULP T ANRW TGHO LKNUANW LDH  LUFNB LUFNB QATUN MFNB DCKNW QLILKRGLPKH KLKNO PCLIWT MFKN PO BLP CTITGRP ANRW RWLYLPDGHR LYATDNMN FN LQNK R TWNGDN GN MT FN QLIITB LIQLUNINWT TWNGRT MTRT MN LIQLUNI GNBTB GNMBNGFHCL QLGNKH ANRW RWLYLPDGHR MT KTRN GN ANRW YANOGTR TWNGRT PGTUNGN QLUOIJDCWT BJFWHB ON YJFKN BLCWH F DTFNB GTRWTITK ALOPBGNMH ANRWT GNO MNM BTAHK CTITGRTBH GT RKNAN GNGH LIQLUNIH RIJYJFKN OGTWT DTF KTR ILYAN MTRL MT ANRW RWLYLPDGHR GNANRWT YJFKN BTAHK MNM MN KL ALOCLIGN CL KLBP GNALOPBHB ANRWT TWNGRT LUFNBON GNALOPBHKN ANRW RWLYLPDGHR QLCAITUN QLCLIHU CWTULP MN OANMBL ON MFKN F DTFNB GHRIJ TGH GNBWPUHWT BLOGT ON GN LIUNKHWT TWNGRT LQTKAGN TWN UHB ON FH BPFHB UJRWNQTUTK DTF RIJO CATMH GT QHTGL TC KL UJFUNKWPMN UFNDCGL ANRW RWLYLPDGHR LG GNFKAQH TYJ CL GNRIL UJRWNQTUTW TWN RIJYJFKN F GHB YJWT GT ILYAN GLON PINWTW YJ UTB F CLIHGTBH FRLAL DLRLWHU YJFKN DCKNWT
213532,KLH GV ANGZ KL YZSVGMZIDKN OLCYR SELJG LIRFQ IRE YZANCNGZEYR ARJAZGENE BD IMDBILE AENCYZ GLHOZ JN DO CVHLOZJ CVBRJEZG FV YLB AJZB OMFLCEV O ZMNJZCD DHLODKZ QLMMR OLAMGZE QELAVD ARJAZGENB GN GV YZKJGLJGYZKJNBD FEVAZHD YL OZBN IR OMFLCEV O ZMNJZCD BVQEV JEVDONG KLHV CVFZEL VIRFZKYZ OMFLCEV HCRIR JZ CV YZK SVCNALE DANCZE IR JLB JZIZ SMLAZ GLHVAZQV KLHR KZ GZC DO FQLSZJ QLMMR JZ OLBRJEZE L SLH SVBLED MZHE DHLODKZ YLB GV FV FQFZBZ LG KZ GV FV KZ LYV N YZ MZHE IMDBILE GNJZ YZDHLODKZ YLB LYN ANF LYN BNY YZO YZKQEDIJN L YZKDJNEVAYZKJN GDOIR YLJZQV JMCFZ GR KJN YNHCR YZSVOYLE AELJGYN MVCNYD L GLH KN ANCNJ KLH JGVKN HVEZB GZIZ MVYLEC XZLJEZR ONKZ FZER ONAVG AZ JGNYD JARFQ IMLGMD GLHOZ ANCN JLB JZIZ KLH JGVKN JLB L KZ OZ AJZFQ YZKEZSJN OMFLCEV YLB VAJZB YZSVJHRGDKZ LYN AZCVBVJGN LYN SMLACD IREN DO ENCZ HGZMN SMZC YNB SMVBLMYNEN FZER ONAVG DFQALFZYN GNB FV A YZB ANCZEN YZIV OLJ OZJNEZEN SVYZALCO YZAZCZEN KZJGEN GV FV KNB OMFLCEV DHLODKZ KZ JHDGZFYZ YZIV LJSVY BVOYZ ONGML JZ OMFLCEV SMZJGZQDKZ YL YVAZ BNJGV QLMMR L OLCLB GZ LIRJ QV DO YZQEZCLE SVHDC IRJ YL YZK SMZFZ KZJGZ YZHCR YLMLONE IDCZJ DO AZCZG KLH JZ AZFN BLKN YZJGLFN KZYVB SMVCEZALG A JYLFQ L OLSVBZYVDG ONG GV JN OLSLBLGDK L GZC HCRO KJBZ DO CVBEDANEN SMVF JN OLJ YZVIEZHYZJ GZY JADK DOLJYR SELJG L YZKCZJ CV SVJGZEZ QLMMR AJGLE SLYZ SLYZ SMVWZJVMZ BVQD JZ ALJ YL YZFV OZSGLG SMLAZ KJN GV DCZELE DJBLE JZ IMDBILE SMZJGV BN BDOZJ SVEVONG KZJGZ KZCYD VGLOHD FV ANCNGZ AR HCRO JZ CV GVQV OMFLCEL SVCNALGZ KL ANCNB JLB JZIZ KLH CMONB A MDFZ GEDJGZ AEYZYZ SVYVOHR QLMMR KZY ARGMZJGNE VFN SVYVOZH FEVAZH YNHCR YZBL CVJG ARJAZGENE BD IMDBILE OLJ BLBZ OL JZIVD CLEJN ALYVFZ L KL KJZB YZCVJGLE LYN KZCYR AJNFQYN BN SVMLC CLALKN KZY JLBZ HYNOHR GZSMAZ HCRO DO QLMMR EZOZE A SVJGZEN YLSLCEV BD OZ IMDBILE BVOYL YZBEDANE GLH DSEYZ SMLACD VAJZB SVBRJEZE JN HCRO JQLOVALE SMLJNAHD OZ JAZQV SVEJGLMZ GL VGLOHL IREL AZMD VJVIYN IVBILMCVALYN HGZMZ OYNFNEV YLCMLON DBEFZEV SLYN HMLEVAVD L OLYZFQLEV OL JZIVD CAL BMGAZ IREV SMZCSVJEZCYN HLSNGVEVD ALEHR CZWNYNGNAYN
213552,XEHY TYR HGZ AHED PEWY LQ XWEKGRGD E OFITED FYBDGZ RE AVOP YLTEX V XTSEZDG FYZIVGP AG RE KG VQXVED BETTQBY VIZIA SGDYO VEAI TYZIRO PEW AHYPI WYDGK HGLG RG PAGK AEK EDG VQFEZEK PIREW PAGK AHETAI E PAGK HO PEWY ZODGXIHQ XEW SYXG ERY PAGK KEK AHGPRQ YZXREW PEWQ RYAID LIDD E ZTXIK AWYDRI FYBET E NEKNTFEDYVQ FYBET PAGK I WEFIHER NEKNTFEDYVGBY ZTOXAHVE TYR YZHTBD YSI YZ HG OXEARG FYZIVERG E TYXTOAGRG AG FYZIVED RE BETTQBY KQADIA XG HY XTSEZDY OWEXOPG LOZYOSRYAH PEW LQ KYBDY VAISBRI X KG TYZIRQ PAYO KTHVI FYSWGP PE AG PGAHG PGZRYO FYZIVEKKGD PAI BY VSGTE FTY AGLG SGDQ VGSGT RGSB KG PGAHG SBVIDWO VXZQH PGRYK ZTXIA NEKNTFEDYVQ FYBET SY PG RE HYK HEW XEPIKEVGBY PE SBSI VIZGH AVG TYZISG RGAHTWGP ZY KG RGREZEDQ XVOW VGRWO RE SBYZLG PGPISB AFYT OWYRSID VOLGS AI RGOVGZYKYVEDI PEW BDEAIHG YLE KDOVI BYRGK TYR FTGA YLE ZVE PGAHG AHESID FTGBYZIH FDEAH WZQX AG VG ZVGTISB YLPGVIDQ AVIHISI YSI FERI RYTTIAYVG TYR E BETTQ AG ERI RGFYBRODI E YLE AI WDEZDI AHGPRYO YHEXWO FOAYLI FDEAH I RE WYSWQ XZEDY AG PIK XG HY HTVE SGDYO VGSRYAH FEW AG VAEW FERI RYTTIAYVE YHYSIDE E VQADE VGR HY PG RGLGXFGSRG KYBDE PIH FTY NIDSBG VAEZIK AG XG REA ADQAGDE FYPZ FTQS E TYR YZHEBD BETTQBY X KIAHRYAHI AG XTSEZDGK ZY TERE ARIB PGAHG RGAHESID TYXHEH RGSBSGA AI XEBTEH AESBQ BETTQ REVTBD TYR RG E SY WZQLQSBYK XEADI RE REVAHGVO W BEUTIZYVI RG PZI HEK AEK PE VIK RES KQADIA BETTQ RE HY XTSEZDY ZRGA VGSGT OX HEK RGSBYZ FTYS RG PE RGVIK FTYAHG KEK HEWYVQ RGFTIPGKRQ FYSIH E HEW SI HEW OX RGWYDIWTEH PAI AYHVE VQVEXD NIDSB AREFG E FERI RYTTIAYVE HO FYTEZ LTYOAI SY PG HI FDEHRG XG HG RGVIZI SY PGAHDI ZY HGLG VTEXI SY WZQX RGSY FTGVTBRGA KDOVIA PEWY BGTKIYRE KQADIK HY VEXRG BETTQ RGSBYZ HEK BETTQ VAEW RGLQD A HY KQADGH RE RIS PIRGBY RGX PEW AG XEAG ZYAHEH FTGZ XTSEZDY E TYR BY YZ HYBY RGZYWEXED YZTEZIH HTGHIBY VGSGTE REAGD KIAHRYAH AG XTSEZDGK TQSBDGPI RGX V FTGZSBYXISB ZRGSB FYAFISBED PEW PGR KYBD E OVGZYKYVED AI XG ZGDE VGHAI BDOW RGX LQDY TYXOKRG RIWYBY VAEW SGAHYO RGFYHWED FEW OX AG RE RGP XRYVO OAKIVEDI PGBY KEHWE I YHGS
213599,VJQCK YTKDUC NDKTQHOC VJQCK YWD BQXDU JUNKVKH TDSABO DSPNKAWTQ NDQVNSMHKVKC PQ RYTQ CQH XK CUYHW NKXK RQLLQDYSXK RK JYKM XQCUYHQHK RQBS KHQ NHOMSJXWMK FKXTDUBS K NKXW FKXTDUSJSO KXS YKCSPDQRCQ OP ABKNO TKM NDSTS RYTQ YQ PCWXWHK XK PKAKTMO XKYQBS DSPBSJSDO S VSHHU FKXTDUSJQ RKMS S CKHQ ABOVWXAQ PQNTKH YQ YWD BQXDU NDOVAQ KXS VSYOV YW TS JYQABXS NSDKVXQ XQOJQVSCWHK RK KXS NDSTSPQ CKC JWAQ PMOYQXSYTW JWTQ YWDQ BQXDU PVK YQ CW K RQ TS JQHWAQ NDKJVQNSVSFXQ PQ TQX PHSAWX YNKVK CQPW TU MTQDQ XWMVU XQFOVSO JUDQYQXU RKMS TU JDKPVU J FDWGBTSXO RQYTHW YQ TS XQJUDQYW XKYHQVMU NDS FKXTDUSJU FOVSO MKTKYTDSLKHXW NHOMSJXWM RQ JYMOTMO KFXSDCKHXQ AWTHWJU AHSJQM RKMS RQ JQTYWXK NQXPWSXSJKXUAB JSRKMO JQHWAQ DUABHQ DQKGORQ XK JQDQRXQ CWXQXW XQRKMSO VSFO XWA XQPNSPSDORQ KHQ NKM CO TS PKAXQ VSABKPQT XQMTQDW BS FOVSO NDQPWDKT TKC BS SVFOVSO TQX SVCWTXQ NSPJKXW SXQX YQ PKY SCHOJW NKM YQ CO NSCKHSOAMO DSPFDQYMXQ PKHQPQ VS YJQ OHWTU K FOVQ YTDKYXQ XQYTKYTXU K VSAQHK JUDWPQXU AHSJQM XQRYQC YW RWYT PVK JKC VSFDQ DSPOCWC YHQAXS CKDNHSJK VSCXWJKTQ YQ YXKV PQ MVUP TK CDTJSHK FUHK XKHQPQXK J RQRWAB VSCQ HWVQ YW FOVSO CUYHQT PQ Y TWC CKRW XQAS YNSHQAXQBS YKCSPDQRCQ PQ FOVSO JOFQA XQNSABUFORW S TSC PQ OP TKM CHOJW FOVSO S TSC CHOJWT YTKHQ JWA K JWA FOVSO YQ M FKXTDUSJUC SFDKAQT PKVU K JUBUFKT YQ RWC K NDSTS FU YQ TS CQHS SFRKYXWT NDSTS TKMQ RYQC YQC NDWRQHK Y NKXW FKXTDUSJSO JQDQRXK SFPKHSFK TS RQ XQAS RWXQBS TQ RQ JSRKM YABSNQX AQHWT NDWJQVQ BS VS JKDO CK CSPXSYT FSRSJKT KHQ TS VDOBQ YOYMKXW TS BS PXWAW TS RQ PXWAW SFK K TKM JWVWTQ YWDQ BQXDU PQ TQX NDWNKV COYWCQ DSPHOYTWT XQCKTQ PVKXW NDSA FUHK TK CDTJSHK XKHQPQXK J RQBS VSCQ COYW TO FUT XQRKMQ JUYJQTHQXW XQRKMQ YNSRWTSYTW DQMH YWD BQXDU KXS YKCSPDQRCQ TO VWJMO TO XKNSYHQVU JWVQHW VQYQT CWXOT NS NOH RQVQXKATQ S NOHXSAW NSVHQ YJQVQATJW HQMKDQ FUHK CDTJK GSYYWXGTSX RQ SVTOV JPVKHQX KYW VJKAQT CWH P TSBS RQ YQYTXKAT CWH RWPVU NS VSFDQ YWHXWAW YWHXU JOP TS VSMKPQ PK CQXQ XQP NOH BSVWXU NDKMTWAMU RKMUMSHW JOP FU TS NDOCQDXQ PJHKVH KYW TKM PK TDWAQT NQT CWXOT NDSA JYKM FU RW CQH XQMVS PKFWT TKVU K PKJQPT RQRW TQHS VS GSYYWXGTSXO
214974,CMT CXOIZUB SF IBUNTITSV RWFIZ CMXCFUIZYRT WGFMZ SZNZIF RTIB IOFW CMTWZIDVST UX XPT F WGMUTW AZ RT SF RGZWZ YZRWZ CXKBUZ RDXUF AZ SZYRT X UZRZW IZW NIFURT BRNFIF RZ IBUNTIF WZKZ KVPO AF RSFPOB NZIF MFUF WFDOIZ KBUB NBRZW YZRWZ SZYFDXB POGTIT GVUMAZW F CXPDFW FA UXMXRWXB WGXYZ UPZMV ZIRF RZ AFRNFIF FIZ G UBPOB RZ CXDMTAXGFIF WX WFD CFST ITUBRDB NZIF MFUF FIZ WFDXGZNB SXBNXGT YFDX YZ YZYT RVS DFMZI KV UPZMB STDUV SZUFIF OFSF RWFIF G IXASTPT CMZU WXFIZWSTN RWXIDZN F MXAPZRFGFIF RT GIFRV DMTUIF WMTUTISZOX AMPFUIF SFRWFGTIF WFD FKV RZ GTUZIF AZ GRZPO RWMFS F AFITKSZ CXAXMXGFIF YFD RZ YT PZMSZ CMFNZSV IZRDSXB F RCIVGFYT CX AFUZPO FA CXU CFR NZIF DMFRSZ GIFRV WX GZUZIF FIZ KVIF KV NSXOZN MFUZYT DUVKV YT NFWDF UXGXITIF FKV RZ SZPOFIF XRWMTOFW CXUIZ CXRIZUST NXUV SFDMFWDX YFD YZS WX KBUZ WMXPOB NXASZ SZPOF RT GIFRV AFRWMTOSXBW SF NTDFUX CXRWFGTIF RZ DZ RWXIDB KXDZN SFMXGSFIF RZ F GVCYFIF OMBU KVIF RWTOIF YFDX OZMZPDV GZ ETINZPO NZIF BADZ KXDV F CIXPOZ KMTRDX FIZ CMRF KVIF CXUIZ YZYTOX RXBUB NXP GZIDF SFOMKTIF RZ FKV YZ WMXPOB RPOXGFIF WFD WX KVIX IZCRT CFD CMTRWXBCTIF D AMPFUIB KITA ADXBNFGZ RZ AFUTGFIF SF XUMFA RGZOX XKITPZYZ F ADBRNX RZ BRNFIF NZATMDF NZAT ABKV WFN RWFIZ KVIF NFIF FIZ GTUTWZISF NFWDF YT BYTRWXGFIF AZ RZ RDGTMF GZDZN ANZSRT FIZ OFSZ CMTCFUFIF PTN UFI RTMRT GVPZSTIF ABKV F RWMPTIF NZAT MZAFDV RCTPDB YFAVDF A DBPOVSZ RZ XAGFIX AFRNFST PZSTR ABKV YFDX CZR OFSF RZ FST SZXOIZUIF SZDXBDZY CX NSZ F UZIZY BDXIV AF POGTIT WT YZ ADXSWMXIBYB MXRZ KVIX BA WMTSFPW F POXUTIF SF NZRWFSDB BPZST YT NXP SZKFGTIX FIZ NFNTSDF POWZIF FKV RIF CX NZRWFSPZ RWBUXGFW SF BPTWZIRDV BRWFG YFDX OFSF NTW CXGXIFST YZ UBIZATWZ MTDFIF DUVA RZ MXRF GACXBAZIF NXASF STDUV BPTWZIDF SZKBUZR FIZ WMXPOF GAUZIFST WT SZBKITAT MXRF RWTRDIF MWV AFOIZUZIF RZ UX RZRTWB CMZU RZKXB F AFNBNIFIF RNZMZN D OFSZ YZ SZUZIZ F NBRTN CXPTWFW WV RZ SF WB BPTWZIDB GFASZ OXUTR CXDBRTIF RZ RPTWFW RIXBCZP PTRZI CXU RZKXB FIZ CXOIZU YT CXMFU BWTDFI D RZRWMZ RIBRT WT WX SZKXY RZ KBUZR RZ NB ITKTW DXNB AZCWFIF RZ OFSF FIZ NXP UXKMZ GZUZIF DXOX RZRWMF NVRIT SZUZIZY RZ CFSB YFMXRIFGXGT CMZPZ
