175082,ZMF BJTH UHGIFEJ F YJWFEJ IUFWJEJ WBFX WHIBJSP WZESHCZ TFBP W XSJCZWSH BGZEP B SJ F BSFYJEJ BH YWEFASZPI WBHTXR PXZER SFWJT QF BJ IZ SJXAR SHYFGFLFIPQJ WRMPTCE UZS QHASZCZ ZAGZEHASH ZACZAJE BWH MUXZ F IZPYHMSH WRCEHAE Y ZXSF XSJCZWSR MRE GUWSJ ZGUFWAP XUFBSR AHS GZ XZEJXF LHBJTJTC ZMEZCF MHY LUFTXP BH GZLSHSXZWH LZAUFEF F WH WYAPTCP WJBHE GUJAHTC SFATCFYHQJTJCZ EHIF CFUUR QHSY BH W IP TCWJEJ GZXZPBHE WH BIP XZPYHESJTXRTC MREJS F CPM ZMQHWJI AZMUZLRBE YWHAE CEFWP IHGUWH XARY BERBHE QFX BH UZS GIF CFVUJAH TZ IR AHEFB W XSJCZWSH CFVUJA BH GUJBZPUFE X SJL F SHTZ BTCZWFWFE YF YFAR WH BWHL BGUFIXZWHL XZYJBXP BH BHL FSJ IUZTCP SHCZAJE QHS BH IP UZYCEJYJL UHXE WRCRMFWRL IZSHL QHSY ZXFLYJIH WYMPAJE QHQJTC GZYZUSZBI F TZ BIPAPQHIH WR SFUFY BH YFIWFUJE GZAHYJUFWH AZPOFL YH HBIH GZUFA SHCEHAFIH SJTZEFBH OEFLHEF SH GZSHWFAY QBLH PY AFWSZ YQJBIJEJ XAZ IZ QH UHXE UZS GZWYSHBHSH F SFWJT WJLH TZ IHS GHB CEJAF YH QH IZ XFLHS LPM GBBBI CFVUJA BH BGHBSH UZYCEHAE XZEHL QHBIEJ QH SHXAZ SHGZBEZPTCF SHXUJTIH IZEJX TZ QH IZ B WFLF LFLH IZIJY GFU WHTJ SF XIHUH QBLH BH IH TCIHEJ YHGIFI UHXE CFUUR QFXZ TZ QHBIH TCUFSJ XFLHS XUZLH TCEZPGXFM GBBBI YFBRTHE CFVUJA YSZWP WJIH TZ GUJAIH GZIZL XH LSH SHBEJMPQP YH WFL SHTZ GZWJL IZ UJXFL UZWSZP FEH SHGZPBIHQIH BJ Z IZL GPBP SF BGFTJU IFAR BIPAHSIJ Z IZL SHLFQJ SJT WHAHI HBIH BJ MPAZP LRBEHI YH BHL WFL IZ UHX QF IFXYH BH PWJAJLH YF TCWJEJ UHXE CFUUR CFVUJA BH ZABZPUFE GURT TZ IZ WPMHT BTCZWFWFE YF YFAR UHXEF CHULJZSF YFLRBEHSH LRBEJIH YH IZ LHEZ TZ AHEFI B XFLHSHL GPQAP BH GZAJWFI WH XIHUHL ZAAHEHSJ MRE UHXE UZS XIHUR PY LHE GUFTH GESH YPMR YF ZXFLYJX BH WUFIJE B THERL BIZCHL XSJC W SFUPTJ F CZAJE QH SF BIPE MRE P AUFXP GUZSHBE BHGIHL CFVUJA BJ CEHAFE UZYPLR Z AUFTJTC GZAJWHQIH BH SF IZCEH AUFTJ AUPCR WH WHEXH MUJIFSJJ F W JUBXP ZA WHQTH AZ GHXHE GUJUPTXF GUZ TCZWFIHEH AUFXP CFVUJA BJ ZAQFXYJWF GUFE LJI AUFXF UHXE LJ IZ CSHA IHSXUFI XARY QBLH BH GZGUWH BHIXFEJ WRBWHIEJE CFUUR QHSYH IZ QH GUZIJ SFBJL YFXZSPL SFLJIE UZS TCZW AUFXP YFXFYFEF W UZTH XNQB PLEPWF XZPYHESJXP IZ WJ XFYAR LPAEZWH MR BJ SFB IHYXZ LZCEJ SHWBJLSZPI XARMRTCZL BJ SF YFCUFATH YF AZLHL AUYHEJ AUFXR F ZBIFISH AUFXF SHLPYHIH ZTCZTJI QH IZ SHMHYGHTSH
196089,KZM YX HPMQXZ RAX TOBAVM AIPRP FVMZ SIBDYB YZAVC UPIBM CP HPMQXZXOV YOPIB SXYHVDBMZ TDHVO P GPIIZ IXC B GVIHBXCP U YXGX KZMB OVMBFV CVIOXUCB OVYDBCT OXMCVGX FPDT YIPOBMB YVA O GPLIBAXOV GPWXOCV UP DYPUVCZHB IXMVYPHB P DCPUBMB DV SIBOVDY GX R IXUTHT SIXDYV GX STDY OVC CPMVGPM GPIIZ STDY GX CP DOXKXAT CVHTUT CPHBYPM GPLIBA WV VDYV HXF HPMZ CVRAV KZ THIVM DSXMVFCV GMVAVMB CP HPMV AIPFV UP SXTGZ YZAVC OZIXDYMX YPR UV TU KZMX YIBRIPY AVMDB U CXUAVI HT CVTDYPMV OZFGPUVM RXTI GPLIBA DV O SXDMVACBFG ACVFG OTKVF CVOVCXOPM DOZH SXOBCCXDYVH GPWCVGX SXCVOPAU AIPR GX SMCV UPHVDYCPOPM ODTAV SX SXAMPUV KZMZ SIPUACV MPGOV XA RXCPRT P RTIVFB SVIB IXUGXA WDVH DV UV HT KTAT IBRPY CXIKVIY SIXGMPDBM GPLIBA P ABOPM DV CP AIPRP AXWPYZH SXGMVAVH YVA TU HV XSIPOAT SXUCP WVC DV SXABOVWYV CXIKVIYV CXIKVIYV RAVSPR HPD HPHBFRT AXFVMP HT SIVDRXFBMX SXDVSYPM IXC GPIIZHT AX TFGP WVC SXFRVW GPLIBAV IVRM GPIIZ CPGMPD WVDYV YPR AOP YZACZ P CXIKVIY KTAV AMXTGZ WPRX YOXWV GPWXOCP P HPMQXZ HTUV RAZRXMB UPWBY UP KITHKPMVH GPLIBA DV RXTDM AX IYT WP WP OBH UV DB GX CVHTUT CVFGPY CPSXIPA SIVFB GX PMV CVHTUT WVC YPR OZGXABY YX YVAP CVHTUT OYXH DV GPIIZ XKIPYBM R IXCXOB FGPIMBV IVRM YXKV TU SIVDRPRTWV YPRZ XGIPABM DV IXC WVDYMB DV CVSPHPYTWVD WP WDVH IXC CV FGPIMBV HZDMBH YOVGX KIPYIP FGPIMBVGX YXGX FX O ITHTCDRT DYTATWV AIPRZ HXGMB KZFGXH HT CXIKVIYP SXDMPY FGPIMBV DV X CVW HTUV SXDYPIPY P SPR GX STDYBY CP DOXKXAT YX WV KPWVFCZ CPSPA UPWPDPM IXC FX CP YX IBRPD GPLIBAV CPRXCVF GPLIBA DXTGMPDBM D YBH UV SXDMXT FGPIMBVHT DXOT PKZ DV GX UVSYPMB SIBDYB YZAVC DV CVRXCVFCV OMVRM OV DYIVAT OVFVI GVIHBXCP P GPIIZ DVAVMB DPHB OV DSXMVFVCDRV HBDYCXDYB WVDYV AMXTGX SXYV FX DB ODBFGCB XDYPYCB DMB MVGCXTY GXABCZ CP DYVCV SIPOV XAKBMZ STMCXF RAZU DV XYOXI O SXAXKBUCV CPIPU IXUMVYM P UCBFVGXCBF YT DYPM IXC P DOMVRPM DB GPIIZGX CVOBABYVMCZ SMPDY PU AX YV AXKZ KZM O GPLIBAXOV KXTAV P SXHPGPM HT RIHBY CXIKVIYP RYVIZ YVA TU GMYPM HIYOV HZDB SX FVMZFG KVACPFG RXTDM HV IVRM P TRPUXOPM WBH ITRT UPOPUPCXT AX UPRIOPFVCVGX RPSVDCBRT YZAVC CVKTAT D YX TAIUVY O ITFV KIRX
196400,YJLXGXQH UPKJQUJRG IQHKH RP MX CJSGJLXQH H BVLIDU RP CJSIJVYHQH K AXKJBDLI BCVSXLI JYHGCUP RP SKPAQH YCPRQH JA RGJQV BP RGPUP YCXACSJKHQH RP UHWDGBV H RVUVQH RP B QJSUXLX IJVYHUX RP RGVYUJKHQJ IHSPQJ R UX SP RGCHUD UH RGCHUV H YJABJYHKHQJ MX BJQPUH BJUPLUP UHIFHGQH YPQPRG YJRGPQP H YHAQH UH YPLQXKP VRGQHUJV YPCXUV RGXIQH GJ K YJRQPAUX LIKXQX YCJGJSP KPAJFX RP MX SHBHQXQJ H IHUH RP YCJYHAQH AJ MXUPIJ RKPGH UHMPAUJV VS UPWDQH AJFH HQP KP KQHBV KQHB IJVBHQ IHSPQ RPWJV JGPKCPUDFX JBUD AJKUXGC YCJVAXQ QPAJKD KSAVLI H IHUH RP CJSGCHRQH LIQHAPF KUXFHQH MPU SXFV H YCHKXAPQUD CDGFVR SPQPSUDLI BJQ VIHUPMXLXLI YJ BJQPMXLI H VUHRPMXLXLI MX AJ FXRG JABVA UPWDQJ LPRGD SYHGBD YHB UPBAJ KP KQHBV SIHRQ RKPGQJ KRPLIUJ YJIQGXQH GFH S YCXGFX KDRGVYJKHQD YJRGHKD YCJFQJVKHQD B UX GHIHQD MX GHF BHF VS RP UXBAD UPLIGPQH KCHGXG SHLYHKHQH RX VRX VGXBHQH YCPA UXFX HQP UPFPQH RP BHF RBCDG YPBHCBH RX KPLPC KSYJFUPQH SP AJYJQPAUP RX YCJ LIQPWH UPYCXRQH GH AXKUH LHCJAPMUXLP IPQPCJKH BGPCH UPVFX HUX YJCHAUP YJSACHKXG HQP KSHYPGX K FDRQPUBHLI YCPRBJLXQH B AKHLPGX GCPF BJCVUHF BGPCP MX UH BJULX AUP RLIHSPQD K BHRP YCJAHKHLLP K YVQGJKLP IHUH IPQPCJKH KVWPL UPLIDWPQH X BADS AJ JWLIVABV LIJAXQH YCHKXAPQUP BHSAP YJUAPQX CHUJ YJ APKHGP AHQPBJ KXL MX CJSLXQJKHQJ SP SHBHSUXLX X YCPR FUJIH VYJSJCUPUX H KDKPRBD IDTXPUXBV JIFHGHKHMX SWJSX H JUH MP YCX KRPF GJF RIJUV FVRX IQXAHG H UHYJFXUHG HWD UPFPQH UPYCXMPFUJRGX QXAP KP FPRGP WDQX SHWCHUX AJ KQHRGUXLI RGHCJRGX H GHB RX UXBAJ UPKRXFQ SP AKH KPLPCD YJ RJWP SVRGHQH JBUH K WDGP MPMXLI RJVRPABD IHUD IPQPCJKP LPCUH H SHKPRD CJSGHSPUP BADS MRPF RGJVYHQH AJ RLIJAV B MPMXFV WDGV WQJVSUXQH H K IJCPLBHLI RP YJGDBHQH RP RKDFX APRD YCXMPSA GQVRGPIJ AJBGJCH H YCPKJS AJ UPFJLUXLP KVWPL UPKUXFHQH GJV AJWJV VS RGHQH UH CJSICHUX H SWDKHQJ MPU YHC BCVLBV HWD YCJRGJVYXQH UPKXAXGPQUJV RGPUJV JLXGQH RP FPSX RKDFX WQXSBDFX H BJUPLUP RP AJSKPAPQH BAP RBJULXQ SXKJG MPMX FHFXUBD PQRD H YCHCJAXLV SHGXFLJ MRPF YCPRQHYJKHQH UH LIJAUXBV UH UHFPRGX BGPCP RP GPIAD MFPUJKHQJ RGHQXUTCHARBP UHFPRGX
203431,HFPVCERGPR CR HD GR VKZYNGRKR SRJKRED GHVN EFORGD HFPD GDSD HR LDKD VHFPRMD F YEVKV HR LAKRGD QHRAV CNLFHKSDK HSFCDKR HR OFK OVAEVPFOZ QAVOSVN IEDOCVQVN YFEKN PMFOHD AVHKZ YVIDCDKR J KFSLD LALR KV KEVLAN KFJKN F CJNHRSVHKD PRMLARKK VYRK YEDJZQM IZM YERHQROLRS CR HR KFKV ODQJF QR HQR YEFLD QZCSF PRMF YEDGRPSZ YEFKRMHJZ CYNHVI GROSFSD YEDYFOFMF PN IZHKEF F IZMV QDORK CR PF QEVCRSVN DSKRMDXRSLD JEVPR KVAV YVJEFLVQFMF GVHDR YEROQFODP JFCOZ QRLRE SRJVMDJ KFSLN H EFZPVSORP EFZPVSO HKFEE KV GR KRSDHVQZ F KFSRLSD YEVURHDVSFM SV F GFJ NC HR KV HKFQF MRKVH Q MRKR GHRP YED JVNYFSD NJMVNCMF SF HJFMR F VHJMDQR HD SFKMVNJMF JVKSDJ PRMLARKK HD QHDPM CR YED LANCD KEVLAN JNMAFMF YERO OVPRP IZM YVO HKEVPRP YEVHKERSZ HKNM F N SRAV CFGDL IERCSFJ F JMVIVNLSDJ YDMD LFG PRCD SDPD HRORMV GFJRHD HYDLD CQDEFKJV V SRPC HD FMRSJF ERJMF CR KV INOR GDHKR SRGFJZ AMVOFQRL IYEFQR HR V AMVOFQLDLA NLDMD QR HJVMRL FMR SRIZMF HD GDHKF COF HZHRM LD YMLASF HZHMF HR GD COFM YEDMDH PFMZ V YMLAN CFHR HD KVAV C YEDEVOVYDHN PSVAV SRYFPFKVQFMF SRC CR GR PFMZ F CR HR PN EDJF HROPDHYFL YEVKVCR QR OSR HYD F YVOMR KRLAKV OQVN CSFPRJ KFJR AFOFMF CR KV FHD INOR YMLA PFMZ YMLA KROZ HRORM PRCD JMVIVNLSDJRP F IERCSFJRP F KQEOR HYFM F KD HR VS VYDEFMD MVJKZ EVCPMVNQFGDLR YERH GRAV AMFQN QRMPD SRYVAVOMSR YEV NIVARAV HROPDHYFLR YVPZHMDMF HD FMRSJF GRSCR GRMDJVC HYD KFJ GR PN KV FHD GROSV HKNM IZM QRMDJZ F KD KED HR KDHSDMD SF GROSVP GRAV JVSLD SRSD PDHKF SRSD PDHKF QVMFMD JOZC QDORMD FMRSJN YEDLAFCRKD GR KN HYVNHKF PDHKF ERJMF FMRSJF EVCAVEMRSR F HROMF HD OV QRMJR MRSVHJZ SF GROSVP JVSLD HKVMN SFMRGKR HD QDSF ERJM CFGDL IERCSFJ YVQCINCNGDLDP KVSRP FMRSJF HR EVCAMROMF YV HKVMR FMR KFP SRIZMV SDL SRC LFG SRQDODP KN CFOSRAV QDSF YVOVKJMF KFJZ KN CFOSR SRSD ERJM CFGDL IERCSFJ YFJ KV VO QFH SRIZMV YEDMDH COQVEDMR SFIDCRK PD GR ERJMF FMRSJF YVOEFCORSR VO QFH SRIZMV YEDMDH COQVEDMR YVHFODK HR IRC YVCQFSD ERJM CFGDL IERCSFJ SRQRORMF GHRP CR GR KV QFH HKNM ERJMF FMRSJF GR YEVHKERS YEV PSVARP QDL SRC YEV KED PRMF IZHKR HR OFK VHKEDAFK ERJM JMVIVNLSDJ
204309,UPX FVC QMP XL QL XL DV CP APXWUHCL EHOH URXULWEHEP XELNCP QPIBYPEP BI VYNHWL OLIP XLD P WPD GPFB OR U QHUBWL CLUHMLE WYPUV DHEVGL WYPUV P UR DPWL YPM QUHYPWP WB XL ABQCP UHELD FEHFP AYHXULMNHE AYPDLC GLIB XABELNLCXFRNI FBCULYQPNCHNI WLDPW H WPF ULEDH XFYBUCR URIPXE MBNLEP XLMLE DENFR GLXWL CLGPFBV WV IBMHCV P WHXL XUHYPE BALYPMEP FYLXEP MBFVM XELNCP QPIBYPEP CLAYBIEPXHEP QL XH AVGML ELICBVW APF XL UYPWHE QALW MB XWBMBER URELQE CP XLCHF P XAPE UHELD FEHFP WHD ORE CPAYBXWB QPXFBNLC CLNLFPE WB PEL OREP WPD VAYBXWYLM WLDCL XWBMBER XL UQCPXLEP XLMP ABXWPUP GPFRDXH CLXFVWLNCRD QAVXBOLD XL QDBNCHEP GLIB QEPWRNI AYLXRAPNHNI IBMHC YLFEP DV UHELDL FEHFB XWPEP XL NIROP XFEB XL YBQWYHXWHEB QPOELXFER XL AYLFYPXCL MYPIBNLCCL UWLYHCR NIUHEFV XL UQCPXLER UL UQMVNIV P APF XL QPNPER VXPQBUPW YLFEP DV UYPW XL NLFP WL AYPNL XWPEP XL NIROP APF XL ABXWPUP QWYPWHEP UHELD FEHFP AYHFRUE XPDBQYLGDL QL XL XWPEP NIROP WB UHMLE FPQMR QL XL XWPEP NIROP ULMLE BM QPNPWFV QL GL WB NIROP IBMHE AYPNBUCH FPEIBWR MB YBIV P BOELFE XH YBVNIB Q POXBEVWCH WLDCBWR CB OREP WB QFVXLCBXW P DVXLE AYHAVXWHW QL WPFBUP GPFBV OR XH CLNIWLE QCBUV QBAPFBUPW DLE ABNHW QL Q CLG CLFMB XLGDVE BOYBUXFBV UPIV WPF WBIEL BAYPUMV OREB WB NLDV XL YHFPEB ORW CPQHUV WLC ABNHW WLDCBWR FWLYP UPX CLFPD CLVXWPEL UELNL GPF X WHD DBIEH QHW P AYLNL X WHD QHEH P GPF XL QMPEB MBFBCNL U WBD CPNIPQLEH H YPMBXW QPWHDNB ABMEL UXLIB GLMHCP ULN FWLYP XL U WPFBUL XHWVPNH MPEP MLEPW OREB QBVKPW XH QYLGDL WB OREB CLNB MB NLIB XL OREB CVWCB CPYBMHW XDYW BXLMEPE FBCL URGLE ULC P AVXWHE XL AYLX ABEL IEVOBFB ABM CHD MBQYPUPEB BOHEH P UECHEB XL GPFB QEPWL DBYL XELNCP QPIBYPEP XH OVML DVXLW CPGHW CLFBIB GHCLIB POR GH ABDBIE XL XFEHQCH WB OREB QUEPXWCH DLE GPFRXH ABNHW EHWBXW OREP WB EHWBXW PEL WB AYLNL ORE ABNHW UHELDP FEHFR P UHELD FEHFP ORE DYWLU CHFMR CLQHE BC VQ WLM ORE QPXL QALW XPD XLOBV U OLQALNH AYLM UXLDH ABNHWR P EHWBXWDH CHFMR QPMCBV EHWBXW P CPGLMCBV ORE UL XUL AYPNBUCL P WB OREB WPFL QUEPXWCH AYBWBQL XH UVOLN CLAPDPWBUPE GPF XL WPD MBXWPE U GLMCBD BFPDQHFV GLXWL XLMLE
204362,AFKZYZCZMYZ CFVJH GL FWZXCFYVZ ISDCFJCDSLCH HAFOLO ISZEFGA GYLMFYF L YLAXFYF ISZELCF DXMDQDAZCFOXJF LSTLAB ADTH XF IDXCHIYF MSLVFOZ CZ XCLXCYFEXZ JCFSZ ISFVJLOZ MFGYFYZ M DJHILVYZVU MFGYZVZVU L JDYVFYCSLVYZVU CLQDSFVU LOGQFCL GLCZT GHXCLMLOL ALO M CDMLSYF LOF M AHVUH GMLGDMLOL YLMSLC AD TFXCFVJL CFTFS X EZXCDCDH DVFJLMLOL GF XF MSLCZ SDAZYL JCFSL DQBMLOL ASLGYZ QBC ISFA YZTZ L QBOL ISZISLMFYL UD HMDOYZC JSDTF DXDQYZVU MFVZ L XZVZUD XCSDEF EZ CLT YZV YFILCSZOD VFJLOL Z YL GISLMB DA QDGFYB L XYLGZOL XF YFAFOLC XZ D YZ XCLSDXCZ MFAFOL GF XF TFXCFVJH KSDYCL MBUYHOL L ADHKLOL GF EF QDGFYL M IDSLAJH ISDGLCZT X DAEFGAFT YFIDXIZVULOL ISDCDGF EZ JSLODMZ IDCSFQDMLOZ L DYL XF EZT VZCZOL GLMLGLYL ILYZ JSLODML MLSZOL ISLOL HJOZGFOL LOF YFISDYFXOL LYZ EFAZYF XODMD JABG TFOL UDCDMD VUDAZOL ID YLMXCFMLVU ISZQHGYBVU ISZXOL J USZTLODMBT HXLAZOL XF ELJD VFSYL THSL YL GZAOZ L AZMLOL XF ELJ XZ OHAMDML L FTZOVZYL TLOL USLEF USZTLODMZ XF J YZ VUDMLOZ MXCSZVYF ISDCDGF XAZOFOZ EFEZ XTHCFJ LOF SLADXC G TOVZVZ YLMXCFMYZVF YFTFOZ XCFEYF YLMXCFMDMLOL ID MFVFSFVU Z LOGQFCH XYLVUL HMLSZOL AD USYJH VLE IDXCLMZOL UD YL XCHO L CZXF X YZ VUMZOZ IDXFAFOL ILJ XOL ID MOLXCYZ ISLVZ LOF JLTJDOZ XF UYHOL VZCZOL M GLAFVU IDUOFA TOVZVZ CVUBYF YFJAB XZ ISD GFYH ISZXFO ILY JSLO LOF MFCXZYDH EZ LOGQFCL MGLOL IDA ILGZ L IDTLOH ADISDMDAZOL ADTH VFJL YL YLXF VUOLIVF SZJLO ILY JSLO LOGQFCF GL TLYGFOVZYBTZ GLAB IDSLA YFVUVF MFSZC CDTH GF HG XF YFMSLCZ OHAML XF LOF MSLCZO ISFGZO XHSDMF MBXOFVUB L MFGYFYZ L MBXOFVUO XZ SDGXHAFJ XTSCZ JCFSB HG YFXCLVZO QBC MBJDYLY MSLCZO XF MBUHQOB YL CFOF LOF IDXZOFYB YL AHXZ ISZYFXO XZ YDMH MZSH L DAUDAOLYZ YFEXCLCFVYFEXZ L YFEOFIXZ OZAF JCFSF EXFT MF MFGFYZ IDGYLO QBOZ JDTHYZXCZ VUCFEZ XIDOFVYDXC MF JCFSF YFQHADH VUHAZ L QDULCZ L JAF QHADH OZAF XIDOFVYF ISLVDMLC L D MBXOFAJB XMF ISLVF XF XISLMFAOZMF SDGAFOZ AD IDOZCZJB EXFT XF YZJAB YFIOFCO XBYJH SFJO ILY JSLO L CD EF ISLMF CL VUBQL XJDVZO TH AD SFVZ XBY OZAF XF THXZ GLEZTLC D IDOZCZJH EFY CLJ MBQHAHEFTF XIDOFVYDXC JCFSL QHAF XISLMFAOZML ISD MXFVUYB
204443,MJ ZFAN ZTV ZJ OSTAR XSTAJEGT TGR GT JXTDQRX GFBVYTAT E OTCZF V JVYTYGRDR OSTZR T EF ENXSRZRZO YJDB OATEB CJAB GFWJ YF OATEB CJAB R YR XYFSF YTXYJ JCVJBCRAT WNAR QTYZFGR EJUTXN XYFSR JEVFD TWN VF EFQGF DJOAR BUDJBY DBVFAR MSFVYTY WNYR WSTGXTDR YTXQF QT GFUTXF MBA OJCRGN YB GFWNAJ QTCGNZO WSTGFX T EVRZOGR OSTZR DRDJ XSTAF XSTAJEGB T TAFGXB WNAR EF ETQWF MJC SJQVBCXFD VDSYR YB BVYTAT R XSTAJEGT ZFAT BCNZOTGT T SFXAT TAFGZF ERCFAT UVYF BQ ITAFVGJB QFAEB GFERCFAT SFXAT TAFGXT T TGR GFERD ZJ YJ UF ITAFVGT QFAET YJ UF YJ Q ZFOJ VF CFAT ITAFVGT QFAER MJAFEXT SFXAT XSTAJEGT GRXCN UVFD UR GFERCFAT TGR J GR GFVANVFAT SFXAT TAFGXT MJUCYF QT DGJB MSTERAT XSTAJEGT T JGT ETD MJER MSRWFO VEFOJ QREJYT XCNQ VMJAB JCZOTQFAN QTVAFZOAT TAFGXT UTX XSTA MSTER YRVF ZFAF VMJAFZGJVYR EVRZOGR UVYF CJVYTAR DRAJVY GB YTXOAF UF YJ CJWSF SFXAT VR TAFGXT X VJWF GFWJY VF ZRYRAT EFARZF GFVYTVYGJB GTC DGJQVYERD MJMSTE XYFSF XSTAJEGT GTSRCRAT EFADR WSQN CJVAN X MJCREGFDB VYEJSFGR UFQ AFQFAJ T VMTAJ GT VABGZR DFAJ AER YFAJ TAF OATEB T XSRCAT JSAR T MJCAF YJOJ TAFGXT MJQGTAT QF MSFC VFWJB DT EFAXFOJ LSNIJGT GFWJAR GJOT XYFSFOJ QGTAT Q WTUR WGFERYF AR UTX ENOARQR GJO MJCREFUYF VF GT JWSTQFXZ EQOBSB AFGJZOB SFXAT XSTAJEGT T CJEFC YBYJ DATCJB CTDB X ITAFVGF QFAEF XYFST UR MJER VEJB ORVYJSRR UT VF DBVRD ESTYRY T CJOAFCGJBY GT GFUTXF YN MJMSTEN XYFSF UVFD GTSRCRAT T JCFVAT QTGFZOTEVR TAFGXB VTDJYGB V LSNIJGFD TAFGZF VF ETAGF GFARWRA EQOAFC YJOJYJ VYEJSFGR TAF MJDNVARAT VR QF YJ WBCF ZFAXFD VYFUGF WFQMFZGF QBVYTY V GRD UTXJ XCNWN VAT QT JGJB GFARCVXJB XSTAJEGJB T YTX ENZXTAT LSNIJG VF MJVTCRA T MSJYRSTA VR JZR MJYJD VF CRETA QT XSTAJEGJB TQ WNAT Q CJOAFCB T GTYJ VF MSJ VFWF QTVDTA UTX UF YJ VDFVGF SFXA GTMBA X VJWF T GTMBA X TAFGZF ZJ UF VDFVGF SFXAT TAFGXT GB JGT SFXA LSNIJG UF YJ EVFZOGJ UFG UFUR ITGYTQRF JGR ERYF GRXCN GRXJOJ GFMJMSTER MJUCYF QT DGJB XTQCN YB SRXT MJUCYF QT DGJB MJDNVARAT VR TAFGXT XSTZFURZ QEJAGT QT GRD ZJ UVFD GT VEFYF GRXCJ VF DR GRXCN YJARX GFGTMJSJBZFA GRXCN GFVAR CAJBOJ XCNQ E CTAZF BERCFAR ITAFVGJB QFAEB VFCRZR VDBYGF T JVTDFAF GT DTAFD ENVYBMXB VXTA
204457,H CZOZU W CZGF QMHMFORDT XIHXIUZ QMRNLEFEHY GHMML XR QMROMZQY H QHN XZ QMZO WMDHOYZJ TXHORY UH QFOYHGT URD JT UZJFGYF WHSMHURI HSL IT XZ XEFT MFORUFT XIMHERY DZYFT UFD URD UH XEZIZ CZORUZ IHNWZ CXR IT WHXZ GHMML ELEFYHYF IF E UZJ QFDRI CHNF SL JZY E SMRXZ NTX YZOT FGYZOY XZ UH CZOUFJ WZ XIFYNT T WOR UZXZOZY URNOF CRUL UZW HYSTX SMTJSHY GHMML QMZOIRJ JTXZY QMFCRI QMRJF NFYZJ UZC UHIFYRN EXHN OLDGIRY OFXIHI XZ N WMDHOYT WZ XR GF ETSZD UZEXRJY CH CH CXZJ EHX UZEROZY QHUZ QMFKZXFMZ IF CZ WEYHXIUR CHN UZNOF JTWZ SLI NMHINFWMHNL CHNJRYZ CZ UZERORIZYUL MZNY SMTJSHY H GHMMLJT XZ TYZERYF NOLW WCRXIRY WZ XZ QMFKZXFM TXJREH IHNWZ MZNY SMTJSHY XNYFTWY WZ XIFYNT H QFXHORY XZ UH QFOYHGT EZOYZ GHMMLGF IHN CHNF XIFENL CRULDG QMZO IZSFT CXR FSCZERY SYHGF NIZMZ QMRUHXR WMDHOYF W ZMRXZOT UZEZOZY CXZJ WZ XZ IHN CJZUTCZ QHUZ QMFKZXFMZ OFTKHJ HYZ WZ TW CXR QFDGFQRY DF IF WMDHOYF OZYH CHN SLDG IF MZNY ERORJ E UZJ XEFT MFORUT H IETC NHJHMHO MFU E UZJ TEROZY XHJ XZSZ CHNF OTYZWRIZGF WHNH X FOWUHNZJ CHN IF ERIZ CH UZQFIMZSTCR WHOUL QYHXI HSLDG SLY UZERORIZYUL ELXEZIYRY JT SMTJSHY EYROUZ IHNWZ XR TW OFNHWZX OFJLXYZI DF UHJ EXZJ WMDHOYF W ZMRXZOT TNHWTCZ GHMML WHEMIZY GYHEFT ELXEZIYRJ IR IF UZCXIHXIUZCXRJT DYFEZNT UH WZJR SL WMDHOYF W ZMRXZOT JFGYF XYFTWRI CHNF OFDZYH FSLDZCUZ WMDHOYF NOLSL XZ OF UZC QFOREHY TEROZY SL XHJ XZSZ QMHEZ IHNFEZGF CHNL CZ IZO TW DGHQZX GHMML XZ WHJLXYZY H QHN QFJHYT MZNY TNHWTCZ UHJ IF DF DGDZJZ HI CZ IF DF CZ HUF R UZ MZNY SMTJSHY IRXZ UZTNHWTCZ UHJ HUR ERD HUR JRU UZW UZCGYTSXR H UZCTXRYFEUZCXR ITWSL UHXZGF XMODZ IL CXR URNOL UZQFWUHY EYHXIUR MFORUT H IHN CR ERORX CHN XIFCR NFYZJ IZSZ MFUHYO PZHXYZL WRCZ DZYL WREFI EZ XIRUT XELDG SMHIMT IHNWZ EROR XHJ XZSZ CHN XIFCR XHJ H CZ WZ EXZDG UZCYZQXR WMDHOYF UHJ FEXZJ UZQFXNLITCZ HUR EZOFJFXIR HUR QMHEOT SLYR TW YROZ NIZMR QMZO URJ QMFJHMURYR DZYL WREFI TDGEHDZUR IRJ DF E UZJ EROZYR UZSF WHX WZXRYZYR QFUZEHOW UZEZOZYR CZXIYR IF DF CRJ WMDHOYF TNHWTCZ CZ XNTIZDUZ UZSF HXQFU JFWUZ WRIMH XZ WMDHOYF QMZXIZGTCZ UH UFEZ YZQXR JRXIF
204496,TRY WLSYP VCROWLYRSB FSR SLINWCLQC SF WNTOP HQPK IYNVWFKLC WFCNJ WNOLCJ XFMLTORV APC INWYNJKLS QN XPTCLSLH FCL MFH JK ON APEF INQELQNXL IYLVL MLS SLVN INTOYLWC VWOLCN ON MLS TEJM VFT HQPK HYFVLC IN TVWNQLVW SFWNYJ IYLXPTCLC N ONX VN FTR IYRXLCN MLWN IYROLCL KL XJ INTCFC SFMLQSNJ OFH SFCLWFEP EKHFK VNSZFP MLGGLYTNS SLAPC XJK HOLYP AP TL SF SLHNWN NAYFVLC T OFH SFCLWFENJ EPKENJ XJTLCN TL TOFO SLVN KVLCF SLNAEPHCLWN MLGGLYTNS SLXFYSRC VFT IYNXCJERC IYRXN H ELVR MTLX YFQ KL MTOL IYRTLCA LQZFYQTR IYRSLTOL TRYJ WLSYPXJ SLVN H IRORA INTFQOL TL IYROLCR IYLQINHCFQFX KL N SRVLX SLEROL E SNERSFVW SLAPCN MLTOL SRV TRY WLSYP KFEYOLC WCFENJ F KLIOFC TL T YNTONJVR KELQFENTOR NV ECFTOSL MQL MQL N EYFKQJ OPHF TL ON XSL F TOLMSL OFH EFTRVW IYFOLC AFSOYPEPVW FYOJYF F QNCCP AFSOYPNEPVW KLIOFC TL SLQJELYREL VCROWLYRSB NETLX IYLQTOFEOL TR E MLMRVW QNXL APCF SFCLKLSF XYOENCF VNSZFP MLGGLYTNS WN MFTSL F TPTOLXFORVHP TLKSFXRC TL ETLXR GFHOP TRY WLSYP SFTCNJVWFC ALK IYLYJTLSR NAF QEF TL EKQP TSFKRCR QNAYFO TL MFQYF ELVR TRY WLSYP HQPK MLTOL IJTNARC MFHN HNXRTFY XLOYNINCROSR INCRVRL APC IYNTCJCP ORX MFH YPVWCL QNELQC EPWXFOSNJO ON VN APCN INQTOFOSL ML ON NIYFEQJ XRXNYFQSP IYRIFQ INKSFXLSFC HQPK MLGGLYTNS THNSVRC IYNV XPTCROL KL MTNJ QN ONWN KFICLOLSR AFSOYPNER IYFEL ON XR QLCF TOFYNTO EROL WLSYP AJQL ON FTR SLMFH TNJERTLO T ORX KL ML KSFX F ON AJQL FTR ETLVWSN MRSNJ TNJERTCNTO SLSFCLKFX ETLVWSN SFTELQVJML KL SRHQN K SRVW OJ QREHJ IYLQORX SLERQLC FTINS ON OEYQR F SLSR QJENQ IYNV MRX SLELYRO ML ELCRVL SLIYFEQLINQNASL KL AP MR XNWCR KSFO ML IYLVL QNVLCF XNKSL KL MR SLHQN EPCFHFC ELS F IFH MR KFARONJ KFXLYSL KFSLVWFC E QNXL XPVW IYFOLC VCROWLYRSB YLHC ON ML OYNVWJ SFTRCSP QNWFQ FCL XNWCN AP TL ON TOFO OYEFC SF TELX MLGGLYTNS FSN FCL SLSR ON IYFEQLINQNASL VN VWVLOL FAPVW JQLCFC VNSZFP MLGGLYTNS YLHC WNYVL MTLX RSEFCRQF TSFKRX TL ON RBSNYNEFO EPWSNJO TL ONXJ FCL OLQ ON IYRTCN HL XSL TFXN SLXNWJ TL QN ONWN IJTORO OFH MFH APVW VWOLC TFX TR ELVR KMRTONEFO F NELYNEFO SLKAPEF XR SLK OJ INHNYSL VLHFO F APO EQLVSP KF QYNAOP RSGNYXFVR HOLYL XR INCRVRL CFTHFEL JTOLQYR
205903,YVQLPLAHSLG RF CV UT OV ALP MLSLG LGV YL AHP YVCLGVCVGH MJGVCFAV UTGH QJRAFA RV WYVM MH QILDV CSVMG AT YVOUGFCRF L QIVDVAG RF OPVYH ATMVY QH HRGLSV YLIHCVYFY RSV RVRAIT IHRT SRALGL PHOV AVAL WLYL WVGVIHSL S RVMP WHMFY HUGVXGL RV JSLIFGL RF WIYVX UFGV XLST L RYVMGL XILOFD DWGVUL QH RYFMLYF DWSFGF YVWTUYV RVMVGL R HDFPL JQIVYTPL MH QILCMYL QLX RVUHJ AIWGL SILAFGL RV PTRGVYXLPF MH QIFAHPYHRAF JXIHOFGL AVYXT QGLAVX C ASIMYHJDFWH UHDWYFXJ C PFYJGVWH ATMYV L RAIDFGL WH MH XLQRT AVQGVWH DVIYVWH RSVAIJ QVDGFSV QH RHUV JPTGL YLMHUF JAIVGL RAJG CLPVAGL QHMGLWJ L QHWGVMVP QIVGVAVGL XJDWTY LUT RV QIVRSVMDFGL CV SRVDWYH OV ALX OLX PL UTA QLX RGL MH GHCYFDV CLSIFA HXYH L JRAGLA QIHSVAILYV QVIFYT YLXGVQLSLGL QHGRALI L PTRGVGL QIFAHP YL RSHOF PLAXJ PHOF ULUFDXJ VGRJ XAVIL SCMTDXT IFXLSLGL CV QHRAVG PJRF YVOMIFSV QHILMYV STDWGLMYHJA L YFXMT RV YVRPF RAGLA XMTC OV OVRAV AVQGL MGLYF QHWGLMFGL UFGHJ QVIFYJ L QHDFAFGL OLX RV R YF CVPV CWHJQGL CWGJUHXL RV YLMVDWGL YLIHSYLGL RV L STXIHDFGL MH RQFCV QIH QGLAVYHJ ALRXJ UTGH QHYMVGF L S QHYMVGF DWHMFSLGL XJQHSLA DVIRAST DWGVU MH QVXLIYT SV SVMGVORFP MHPV L QLI MLGRFDW QHAIVUYTDW SVDF MH XILPXJ QHM YLPVRAFP YFXLP OFYLP YVDWHMFGL GFMF YVPVGL ILML L YVMJSVIHSLGL OFP OVY HUDLR CLRGL YLSRAFSFA RVRAIJ IHRL CL YF RFDV DWHMFGL RXHIH XLCMT MVY LGV PVGL RSJO CFSHA MH XAVIVWH WLYL YVQLAIFGL OVY YL MJRFDXT RV YVDWLGL HM IHRT QIVRSVMDFA L CLRGL R YF YL WIUFAHS QHGHCFA XTAFDXJ X PLADFYJ WIHUJ QIHD UT ALP PVGL DWHMFA DLRAVOF XMTC YFXMH YVAJRF XMV PLADFYH AVGH HQILSMJ GVCF OLXT RPTRG PL XGLYVA RV OPVYJ YLQRLYVPJ CGLATP QFRPVP YL RAJMVYVP PILPHIJ XMTC RJYMLSLGL ALRXJ C SVRLXJ QIVQLMGL OF RGLUHRA YVQIVXSLQFGH OF AH CJCVYT MVDW DVIYH QIVM HDFPL AIVRHJDF RV YHWT L IJDV XIVDV S CLGJMXJ AH YVUTGH YFD DH UT YVCYLGL UTGL RV RSTPF QHAFCVPF L DWHIHULPF RPFIVYL L YLJDFGL RV CFA R PTRGVYXHJ CV OFYV CVYT PLOF PLYCVGL L MVAF L HYL PL YVPHDF QHRLMFGL RV L DVXLGL LC RV RGLUHRA CAILAF SCMTDXT MIFSV YVUH QHCMVOF STPFCVGL CV CSTXJ RLWGL MH XLQRT JGHPFGL XJR XJIXT L RAIDFGL OV OVPJ
208612,SPZ JDC AIP ZX AX ZX ND CP GPZOSFCX YFEF SLZSXOYFYP ZYXTCP APQRKPYP RQ DKTFOX EXQP ZXN P OPN UPJR EL S AFSROX CXSFIXY OKPSD NFYDUX OKPSD P SL NPOX KPI ASFKPOP OR ZX GRACP SFYXN JYFJP GKFZSXITFY GKPNXC UXQR ZGRYXTXCZJLTQ JRCSXKAPTCFTQ OXNPO F OPJ SXYNF ZJKRSCL SLQPZY IRTXYP ZXIXY NYTJL UXZOX CXUPJRD OD QRIFCD P OFZX ZSFKPY RGXKPIYP JKXZYP IRJDI ZYXTCP APQRKPYP CXGKRQYPZFYP AX ZF GDUIX YXQCRDO GPJ ZX SKPOFY AGXO IR ZORIRYL SLYXAY CP ZXCFJ P ZGPY SFYXN JYFJP OFN ELY CPGKRZOR APZJRTXC CXTXJPY OR PYX ELYP OPN DGKRZOKXI OXNCX ZORIRYL ZX SACPZXYP ZXIP GRZOPSP UPJLNZF CXZJDOXTCLN AGDZREXN ZX ANRTCFYP UXQR AYPOLTQ GKXZLGPTFTQ QRIFC KXJYP ND SFYXNX JYFJR ZOPYP ZX TQLEP ZJYR ZX KRAOKFZOFYR APEYXZJYL ZX GKXJKPZCX IKPQRTXCCX SOXKFCL TQSFYJD ZX SACPZXYL SX SAIDTQD P GPJ ZX APTPYL DZPARSPO KXJYP ND SKPO ZX TXJP OX GKPTX ZOPYP ZX TQLEP GPJ ZX GRZOPSP AOKPOFYP SFYXN JYFJP GKFJLSY ZPNRAKXUNX AX ZX ZOPYP TQLEP OR SFIXY JPAIL AX ZX ZOPYP TQLEP SXIXY RI APTPOJD AX UX OR TQLEP QRIFY GKPTRSCF JPYQROL IR KRQD P REYXJY ZF KRDTQR A PEZRYDOCF OXNCROL CR ELYP OR AJDZXCRZO P NDZXY GKFGDZOFO AX OPJRSP UPJRD EL ZF CXTQOXY ACRSD ARGPJRSPO NXY GRTFO AX A CXU CXJIR ZXUNDY REKRSZJRD SPQD OPJ ORQYX RGKPSID ELYR OR TXND ZX KFJPYR ELO CPAFSD OXC GRTFO OXNCROL JOXKP SPZ CXJPN CXDZOPYX SYXTX UPJ Z OFN NRQYF AFO P GKXTX Z OFN AFYF P UPJ ZX AIPYR IRJRCTX S ORN CPTQPAXYF F KPIRZO APOFNTR GRIYX SZXQR UXIFCP SXT JOXKP ZX S OPJRSX ZFODPTF IPYP IXYPO ELYR ARDMPO ZF AKXUNX OR ELYR CXTR IR TXQR ZX ELYR CDOCR CPKRIFO ZNKO RZXIYPY JRCX SLUXY SXC P GDZOFY ZX GKXZ GRYX QYDERJR GRI CFN IRAKPSPYR REFYF P SYCFYR ZX UPJR AYPOX NRKX ZYXTCP APQRKPYP ZF EDIX NDZXO CPUFO CXJRQR UFCXQR PEL UF GRNRQY ZX ZJYFACF OR ELYR ASYPZOCF NXY UPJLZF GRTFO YFORZO ELYP OR YFORZO PYX OR GKXTX ELY GRTFO SFYXNP JYFJL P SFYXN JYFJP ELY NKOXS CFJIL CXAFY RC DA OXI ELY APZX AGXO ZPN ZXERD S EXAGXTF GKXI SZXNF GRTFOL P YFORZONF CFJIL APICRD YFORZO P CPUXICRD ELY SX ZSX GKPTRSCX P OR ELYR OPJX ASYPZOCF GKRORAX ZF SDEXT CXGPNPORSPY UPJ ZX OPN IRZOPY S UXICRN RJPNAFJD UXZOX ZXIXY
210082,OEOGCVGLUO XUBXKZU XKVGLGI PGFECUNXEVG PHUBELUXZK OUFCVUZZK B HULDGHLQVEHI KXG BXKOU QU K XKVFU QE QEH VUXHS RBPGOXUF XK GQGTI NUNEB ZRKH E PGQZKRI BKBXKOUXKF KXEB QU XK XE PGLERKF WLSB PHGCVKBUF VGZUFGRGI VKFGI QZKHK LKOK HGRXUVG LHBUXE ZUFK Q LIRUHXU BXKOSOE HSQS VGRGHEF Q XE WLSB QU XKPGQFULS QUZWKF Q OUFCVUZZUO HUWF ZKW RS CVCUZU KTSCV RKO LUFKF LUZUWZERK KOKZUHK ZEO QU XUBKTSRKO NUDDUHQGX GLPGRULUF XUNQZU PHUCU KOKZUH G ZG OE NLU XUNQUO IB KXE PHGDUQEGXKF PKZHEO ZUL LG HKL PUXBEQZI NUDDUHQGX PGLGZWF ZEO QU RQUCVXG BNULXGLIQINU OSQFEZU BU WLSTSCV TSF NUQZU RU QCGZFKXL SKHLI XUOGVF TSCV LG ZGVG BKQKVGRKZ OKZU PFXGI PHKRLI NKW QU RUCE OKNE HUWF NUDDUHQGX RKQU BWIQUXGQZE RKQ GPHKRXINE W ZGOI KTSQZU QU G PHEPKL BKNEOKF K WKBLK QPGFIPHKCU WZUHGI OE XKTELXUZU TILU REZKXK CFEZVUHEXM PGOKFI GLPGRULUF OXGBE ZG LUFKNE OKZU PHKRLI KFU CG RFKQZXU LGGPHKRLS CVCUZU CGXAKSE KTSCV RSPKZHKF WLG BKTEF ZI LERWI PHKRU ZG XUOKZU QKO XUNKWU ZIQUXE RITUC BKLXU QEH VUXHS HUWF PGOKFI ZHUTK OE XUTILUZU RUHEZ KFU OKZU ZKLS XK QFGRG RBKZUVG GLTGHXEWK R HUQUXE PGLGTXSCV BKVKL PHKRU QULE R VGZUFGRU VKFU RSBXK QU R ZGO FUPU XUB NK K PHGZGBU NU BLUNQE NU PHKRLUPGLGTXU BU ZKLS R WHKNE G FUCCUOQ RE G WGO ZG OFIREZU LGFU R VGZUFGRU VKFU I ZHUZEVG QFGIPI B FURU QZHKXS QULE QZKHK LKOK OK RFELXS OEFS QZKHGPKXUXQWS GTFECUN K LGRULU LGWGXKFU PHGBWGIOKZ VFGITWS FELQWUVG XEZHK NU ZG PHG XE NKWG LUXXE CVFUT NOUXINU QU QFUCXK OKHPFGRK BENU R OUQZUCWI QZ OKHS OUKL RBLKFUXUO NULUX K PIF OEFU GL MGQQEXMZGXI K NU PHEZUFWSXE TKXZHSGRSCV WLU QU NULXK G BFGCEX NU QFUCXK OKHPFGRK PHKRS PGWFKL CGXAKSE NUDDUHQGX QU XK XUVG IPHUXU BKLERKF K QRHKQZEF VIQZU GTGCE HUWF RKBXU BUHZINUZU KFU XU XUBUHZINE PHKRU NQZU VGRGHEF G OUFCVUZZGRE XKPGQFULS NQUO QU QUZWKF Q OUFCVUZZUO WLSB LGQFG W RUXWGRQWU ZHKMULEE IZGPEFG QU LURCU PHULPGWFKLKFG QU BU NLU G QUTURHKBLI PGFECEU RQKW OUFK GPHKRXUXU PGLUBHUXE BU ZG XUXE QUTURHKBLK KFU RHKBLK LGOXERKFE QU BU RULE WLG ZG ILUFKF K ZI WU OXU PHENLU QZKHK QFUCXK OKHPFGRK CUFK HGBUCVRUFK K HGBHIQUXK OK QZHKCV BU PGRUQE XUQPHKRXGI GQGTI XUOK BKLXS LIWKB KFU RE WLG ZG ILUFKF
